,Sentences_from,Sentences_to,Translated_sentences,BLEU
450,"Stracił zaufanie do żony od chwili, gdy nie chciała mu pomagać w nastawianiu sideł na sir Karola.",Stapleton's first idea was that this young stranger from Canada might possibly be done to death in London without coming down to Devonshire at all.,He had lost confidence in his wife from the moment she refused to help him set snares for Sir Charles.,0.0
451,"-- Jeżeliś go nie widział, to skądże wiesz, że był na strychu?","""If you didn't see him, how do you know he was in the loft?""","-- If you didn't see him, how do you know he was in the attic?",0.919
452,"Wydawała się, jakby cudownem, nadprzyrodzonem zjawiskiem na tle ponurego krajobrazu.","Her eyes were on her brother as I turned, and then she quickened her pace towards me.","It seemed like a miraculous, supernatural phenomenon against the background of the gloomy landscape.",0.0
453,"-- Nic jeszcze nie rozumiem; bądź co bądź, to dziwne, jak wszystko, co się panu przytrafia od chwili powrotu do kraju. Ale mamy już kilka nici w ręku i spodziewam się, że nie ta, to druga, doprowadzi nas do wykrycia prawdy.","""What do you make of it yourself?""","-- I understand nothing as yet; be that as it may, it is strange, like everything that has happened to you since your return to the country. But we have several threads already in hand, and I expect that not this one, but another, will lead us to the discovery of the truth.",0.0
454,Czy możesz pan wstać o własnej sile?,"Are you strong enough to stand?""",Can you stand up in your own strength?,0.0
455,"-- Ja słyszałem płacz najwyraźniej i mógłbym ręczyć, że płakała kobieta.","""I heard it distinctly, and I am sure that it was really the sob of a woman.""","-- I heard crying apparently, and I could vouch that a woman was crying.",0.0
456,Reszta kapitałów przeszła na sir Henryka. -- Ile wynoszą?,"The residue all went to Sir Henry.""",The rest of the capital has passed to Sir Henry. -- How much?,0.0
457,"Gdy doktor Mortimer wymienił mi pańskie nazwisko; domyśliłem się odrazu, że pan Sherlock Holmes wziął w swoje ręce tę sprawę i że pan tu przybyłeś z jego ramienia. Rzecz naturalna, że chciałbym się dowiedzieć, co pan Sherlock Holmes o tem myśli.","When Mortimer told me your name he could not deny your identity. If you are here, then it follows that Mr. Sherlock Holmes is interesting himself in the matter, and I am naturally curious to know what view he may take.""",When Dr. Mortimer mentioned your name to me; I guessed at once that Mr. Sherlock Holmes had taken the matter into his own hands and that you had come here on his behalf. It's only natural that I should like to know what Mr. Sherlock Holmes thinks of it.,0.093
458,"-- Seldon wypatrzył, że jakiś chłopak zaopatruje go we wszystko.","""Selden found out that he has got a lad who works for him and brings him all he needs.",-- Seldon saw some guy supplying him with everything.,0.0
459,"-- Artykuł wstępny traktuje o wolnym handlu. Pozwólcie mi odczytać z niego jeden ustęp: „Nie należy się łudzić, że taryfa protekcyjna osłoni nasz przemysł.","""Might I trouble you for it--the inside page, please, with the leading articles?"" He glanced swiftly over it, running his eyes up and down the columns.","-- The introductory article deals with free trade. Let me read one paragraph from it: ""We should not delude ourselves that a protective tariff will shield our industries.",0.0
460,"Taki głos ironiczny, chłodny, miał tylko jeden człowiek na świecie.","That cold, incisive, ironical voice could belong to but one man in all the world.","Such an ironic, cool voice only one man in the world had.",0.0
461,Łotr uciekał z tym butem w ręku. Tu właśnie go rzucił.,And he hurled it away at this point of his flight.,The villain was running away with that shoe in his hand. This is where he threw it.,0.0
462,-- Watson... -- szepnął baronet -- to było szczekanie psa!...,"""Watson,"" said the baronet, ""it was the cry of a hound.""",-- Watson... -- whispered the baronet -- it was a dog barking!....,0.26
463,"Zataiłem to przed sędzią śledczym z pobudek, które pan zapewne zrozumie. Jako człowiek nauki, nie chciałem zdradzać się publicznie, iż wierzę w przesądy.",My motive for withholding it from the coroner's inquiry is that a man of science shrinks from placing himself in the public position of seeming to indorse a popular superstition.,"I concealed this from the investigating magistrate for reasons you will understand. As a man of science, I did not want to betray to the public that I believed in superstition.",0.115
464,-- Czy niema innych kandydatów do spadku?,"""There is no other claimant, I presume?""",-- aren't there other candidates for relegation?,0.0
465,"Na tle księżycowej tarczy odrzynały się skały, lecz żywy posąg nie stał już na ich szczycie.",He might have been the very spirit of that terrible place. It was not the convict.,"The rocks were jutting away against the moonlit shield, but the living statue no longer stood atop them.",0.0
466,"Fakty następowały tak szybko po sobie, że trudno było je spisywać. Donosiłem ci, żem widział Barrymora, zakradającego się po nocy ze światłem w ręce do pustego pokoju.","In my last report I ended upon my top note with Barrymore at the window, and now I have quite a budget already which will, unless I am much mistaken, considerably surprise you.",The facts followed each other so quickly that it was difficult to write them down. I told you that I saw Barrymor sneaking into an empty room at night with a light in his hand.,0.0
467,"Gotówbym się założyć, że go niema w Merripit-House. Swoją drogą, przetrząśniemy dom od strychu do piwnic.","But we'll search the house and make sure.""","I'm willing to bet he's not at Merripit-House. By the way, we'll sweep the house from attic to basement.",0.0
468,"Ale czy nie znajdujesz, Watson, że zbyt długo pozostawiłeś pupila bez swej opieki?...","Don't you think, Watson, that you are away from your charge rather long?","But don't you find, Watson, that you've left your pet unattended too long?...",0.0
469,Wystraszył mnie takim argumentem i zmusił do milczenia.,"He frightened me into remaining silent.""",He frightened me with such an argument and forced me to remain silent.,0.0
470,"Ale mam nadzieję, że nie będziemy już długo czekali.",Broad bars of golden light from the lower windows stretched across the orchard and the moor.,But hopefully we won't be waiting much longer.,0.0
471,"Ot, i druga sprawa nie obchodzi mnie osobiście, a jednak wykryłem rzecz bardzo ważną.","I told them that they would have occasion to regret their treatment of me, and already my words have come true.""","Oh, and the other thing I don't care about personally, and yet I detected a very important thing.",0.0
472,"-- Zmusi go do ostrożności, a może skłoni do ostatecznych czynów.","""It may cause him to be more cautious, or it may drive him to desperate measures at once.","-- will force him to be cautious, and perhaps prompt him to the ultimate deeds.",0.0
473,"Wystraszony, odparł, że przed chwilą biegły za jakąś dziewczyną. -- „Ale widziałem coś więcej -- mówił. -- Hugon Baskerville pędził tędy na swojej karej klaczy, a za nim leciał jakiś pies okropny, czarny, jakby szatan wcielony. Niech mnie Bóg broni, żebym kiedy jeszcze miał spotkać podobnego potwora na mojej drodze.","But at length some sense came back to their crazed minds, and the whole of them, thirteen in number, took horse and started in pursuit. The moon shone clear above them, and they rode swiftly abreast, taking that course which the maid must needs have taken if she were to reach her own home.","Frightened, he replied that they had been running after some girl a while ago. -- ""But I saw something more -- he said. -- Hugon Baskerville came rushing down the road on his mare, followed by a horrible dog, black as Satan incarnate. God forbid that I should ever again meet such a monster in my path.",0.0
474,"Cały stok był usiany okrągłemi, foremnemi kamieniami.","The whole steep slope was covered with gray circular rings of stone, a score of them at least.","The whole slope was strewn with round, shapely stones.",0.0
475,-- To admirał Baskerville; służył w Indyach Zachodnich pod Rodneyem.,"""That is Rear-Admiral Baskerville, who served under Rodney in the West Indies.",-- This is Admiral Baskerville; he served in the West Indies under Rodney.,0.279
476,"-- Mam nadzieję, że trzymaliście się panowie razem?","""You have always kept together, I presume?""",-- I hope you guys have been sticking together?,0.0
477,Wtedy baronet drzwi otworzył i wyszliśmy na palcach.,Then the baronet gently opened his door and we set out in pursuit.,Then the baronet opened the door and we tiptoed out.,0.0
478,"Cartwright w przebraniu chłopca wiejskiego, oddawał mi znaczne usługi.","Cartwright had come down with me, and in his disguise as a country boy he was of great assistance to me.","Cartwright, disguised as a country boy, rendered me considerable service.",0.126
479,"Im dłużej tu bawię, tem bardziej czuję się smutny i zaniepokojony. Te bagna rzucają cień na duszę.","When you are once out upon its bosom you have left all traces of modern England behind you, but on the other hand you are conscious everywhere of the homes and the work of the prehistoric people.","The longer I stay here, the sadder and more troubled I feel. These swamps cast a shadow over my soul.",0.0
480,Jechaliśmy za nimi; wysiedli gdzieś tutaj w pobliżu.,"We followed their cab until it pulled up somewhere near here.""",We followed them; they got off somewhere around here.,0.0
481,-- Ta ścieżka prowadzi do Merripit-House -- rzekł Stapleton. -- Może mnie pan zechce zaszczycić swojemi odwiedzinami?,"""A moderate walk along this moor-path brings us to Merripit House,"" said he. ""Perhaps you will spare an hour that I may have the pleasure of introducing you to my sister.""",-- This path leads to Merripit-House -- Stapleton said. -- Would you care to pay me a visit?,0.0
482,"Przypuśćmy, że jest tam jakiś pies zdziczały -- byłoby to wyjaśnieniem tych wszystkich zagadek. Lecz gdzież taki pies ukrywa się?","He is no one whom I have seen down here, and I have now met all the neighbours.",Suppose there is a feral dog--that would explain all these mysteries. But where does such a dog hide?,0.0
483,"-- Wolałbym, żebyś mi to opowiedział żywem słowem.","""Perhaps you would kindly give me a sketch of the course of events from memory.""",-- I'd rather you tell me in living words.,0.0
484,-- To jednak dziwne! -- zauważył doktor Mortimer. -- Przeszukałem starannie cały pokój przed śniadaniem...,"""But it is a very singular thing,"" Dr. Mortimer remarked. ""I searched this room carefully before lunch.""","-- It is strange, though! -- Dr. Mortimer remarked. -- I carefully searched the entire room before breakfast...",0.193
485,"Przez pół godziny czekałem w natężeniu, ale oprócz płaczu nie usłyszałem nic zgoła.","The noise could not have been far away and was certainly in the house. For half an hour I waited with every nerve on the alert, but there came no other sound save the chiming clock and the rustle of the ivy on the wall.","I waited in intensity for half an hour, but I heard nothing but crying.",0.065
486,-- Kiedy się dowiedziałeś o przebywaniu drugiego człowieka na bagnie?,"""Excellent, Watson! And how did you localize me?",-- when did you become aware of the other man's being in the swamp?,0.0
487,Należało odjąć wizycie wszelki charakter uroczysty.,The more formal we made the visit the less information we might obtain.,It was necessary to subtract any ceremonial character from the visit.,0.0
488,"Zaczynam więc od dnia, następującego po tym, w którym wykryłem dwa bardzo ważne fakty: a więc naprzód, że pani Laura Lyons z Coombe-Tracey pisała do sir Karola Baskerville i wyznaczyła mu spotkanie o godzinie, w której śmierć znalazł; powtóre, że człowiek, przebywający na bagnie, ukrywa się w jednej z jaskiń na stoku góry.","I start then from the day which succeeded that upon which I had established two facts of great importance, the one that Mrs. Laura Lyons of Coombe Tracey had written to Sir Charles Baskerville and made an appointment with him at the very place and hour that he met his death, the other that the lurking man upon the moor was to be found among the stone huts upon the hill-side.","I begin, therefore, with the day following that on which I discovered two very important facts: thus, first, that Mrs. Laura Lyons, of Coombe-Tracey, wrote to Sir Charles Baskerville, and appointed him to meet him at the hour when he found death; secondly, that the man, staying in the marsh, is hiding in one of the caves on the hillside.",0.158
489,"U stóp naszych leżało olbrzymia psisko, wielkości młodej lwicy; był to mieszaniec wyżła i brytana.","In mere size and strength it was a terrible creature which was lying stretched before us. It was not a pure bloodhound and it was not a pure mastiff; but it appeared to be a combination of the two--gaunt, savage, and as large as a small lioness.","At our feet lay a huge dog, the size of a young lioness; it was a hybrid between a Great Dane and a Britannia.",0.0
490,"Mówię to, żeby panu ułatwić rozwiązanie zagadki, nad którą pan zastanawiał się, patrząc na oparzeliska.","All this, Dr. Watson, has been brought upon your head by your expression as you surveyed the moor out of our window.""",I say this to help you solve the puzzle you were pondering as you looked at the burns.,0.0
491,-- Jesteś w błędzie co do jego fachu.,"""Surely you are mistaken about his trade?""",-- you're wrong about his trade.,0.0
492,"Maść w tej oto blaszance jest zapewne mieszaninę siarki i fosforu, którą pies był wysmarowany.","On an emergency he could keep the hound in the out-house at Merripit, but it was always a risk, and it was only on the supreme day, which he regarded as the end of all his efforts, that he dared do it.",The ointment in the tin here is probably a mixture of sulfur and phosphorus that the dog was smeared with.,0.0
493,-- Nazywa się Seldon. Wpakowano go do więzienia za morderstwo w Notting-Hill.,"""It is Selden, the Notting Hill murderer.""",-- His name is Seldon. He was sent to prison for murder in Notting-Hill.,0.0
494,-- Czemuż więc nie uprzedziłaś pani o tem sir Karola?,"""Why then, did you not write to Sir Charles and explain this?""",-- So why didn't you tell Sir Charles?,0.0
495,"-- O ile można przypuszczać, te słowa zostały wycięte scyzorykiem.","""So far as I can follow you, then, Mr. Holmes,"" said Sir Henry Baskerville, ""someone cut out this message with a scissors--""","-- As far as can be surmised, these words were cut out with a penknife.",0.0
496,"Wróciłem do moich towarzyszów, aby zdać raport Holmesowi.","""You say, Watson, that the lady is not there?"" Holmes asked, when I had finished my report.",I returned to my companions to report to Holmes.,0.0
497,Ręczę panu za to słowem honoru.,But he will never trouble anyone in this country again.,I'll vouch for that in my word of honour.,0.0
498,Odrzekła mi na to bez namysłu:,She met my difficulty with the utmost readiness.,She answered me without thinking:,0.0
499,"Księżyc w pełni zachodził za jedną z wyższych skał; wtem na jej szczycie ujrzałem postać męską, wyglądającą jak posąg.","The moon was low upon the right, and the jagged pinnacle of a granite tor stood up against the lower curve of its silver disc.","The full moon was setting behind one of the higher rocks; then at the top of it I saw a male figure, looking like a statue.",0.0
500,"„Otóż ów Hugon pokochał (jeśli można tem mianem nazwać tak dzikie uczucie), pokochał zatem córkę czynszownika, dzierżawiącego grunta w pobliżu dóbr Baskerville.","This, in truth, his neighbours might have pardoned, seeing that saints have never flourished in those parts, but there was in him a certain wanton and cruel humour which made his name a byword through the West.","""Well, this Hugon fell in love (if such a wild feeling can be called that), so he fell in love with the daughter of a tenant farmer near the Baskerville estate.",0.0
501,Nasz baronet zaczyna interesować się żywo piękną sąsiadką.,"The fact is that our friend, the baronet, begins to display a considerable interest in our fair neighbour.",Our baronet begins to take a keen interest in his beautiful neighbor.,0.0
502,"Jak wryty w ziemię, stał żołnierz na koniu, z bagnetem przez ramię.","A steep curve of heath-clad land, an outlying spur of the moor, lay in front of us. On the summit, hard and clear like an equestrian statue upon its pedestal, was a mounted soldier, dark and stern, his rifle poised ready over his forearm. He was watching the road along which we travelled.","As if stunned into the ground, there stood a soldier on horseback, with a bayonet over his shoulder.",0.0
503,"Gdybyż tylko na tem poprzestał! ale on chce podobno wytoczyć proces doktorowi Mortimer za otwarcie grobu przedhistorycznego bez pozwolenia potomków, a to skutkiem... czaszki z epoki neolitycznej, odgrzebanej w Long-Dawn.","If he would confine his energies to this all would be well, but there are rumours that he intends to prosecute Dr. Mortimer for opening a grave without the consent of the next-of-kin, because he dug up the Neolithic skull in the barrow on Long Down.",If only he'd stopped there! But he's about to sue Dr. Mortimer for opening a prehistoric tomb without permission from his descendants... a Neolithic skull unearthed at Long-Dawn.,0.1
504,"Kamerdyner przyniósł mi kawę do biblioteki; skorzystałem z tego, aby mu zadać parę pytań.","The butler brought me my coffee into the library, and I took the chance to ask him a few questions.",The butler brought me coffee in the library; I took advantage of that to ask him some questions.,0.22
505,"Przykro mi, że się panu narzucam, ale nie mogę puścić pana samego na trzęsawiska.","I am sorry to intrude, but you heard how earnestly Holmes insisted that I should not leave you, and especially that you should not go alone upon the moor.""","I'm sorry to impose on you, but I can't let you out on the moors alone.",0.0
506,"-- Gdybyś nam się zwierzył z własnej i nieprzymuszonej woli, byłaby rzecz inna -- przekładał mu baronet -- ale powiedziałeś nam, a właściwie twoja żona powiedziała nam prawdę pod naciskiem, więc mamy ręce rozwiązane.","""If you had told us of your own free will it would have been a different thing,"" said the baronet, ""you only told us, or rather your wife only told us, when it was forced from you and you could not help yourself.""","-- If you had confided in us of your own and free will, it would have been a different thing -- the baronet translated him -- but you told us, or rather your wife told us the truth under pressure, so our hands are untied.",0.403
507,"-- Dziwne to pytanie... -- rzekła, udając obrażoną.","""Really, sir, this is a very extraordinary question.""","-- Strange question... -- she said, pretending to be offended.",0.0
508,"W oczach wszystkich ów zbrodniarz był potworem i wyrzutkiem społeczeństwa; ona widziała w nim zawsze chłopaka z jasnymi kędziorami, którego nosiła na ręku i kochała, jak własne dziecko.","To all the world he was the man of violence, half animal and half demon; but to her he always remained the little wilful boy of her own girlhood, the child who had clung to her hand.","In the eyes of everyone this criminal was a monster and an outcast of society; she had always seen in him a boy with fair hair, whom she carried in her arms and loved as if he were her own child.",0.0
509,"Holmes, patrząc na trupa, śmiał się, ręce zacierał.",He had uttered a cry and bent over the body. Now he was dancing and laughing and wringing my hand.,"Holmes, looking at the corpse, laughed, hands rubbing together.",0.0
510,Mój przyjaciel i ja jesteśmy w zbrojnem pogotowiu.,"My friend and I are also ready for emergencies.""",My friend and I are on armed alert.,0.446
511,"Miałem tylko trzy pary: nowe żółte, stare czarne i te oto lakierki. Wczoraj zniknął jeden od żółtej pary, a dziś jeden od czarnej.","""What! you don't mean to say----?""","I only had three pairs: the new yellow ones, the old black ones, and these here varnish ones. Yesterday one from the yellow pair disappeared, and today one from the black pair.",0.0
512,"Noc była tak ciemna, że przy najlepszym wzroku niepodobna było nic dojrzeć.","The man is a striking-looking fellow, very well equipped to steal the heart of a country girl, so that this theory seemed to have something to support it. That opening of the door which I had heard after I had returned to my room might mean that he had gone out to keep some clandestine appointment.",The night was so dark that with the best of eyesight it was impossible to see anything.,0.0
513,"Wszak pan, sir Henryku, opuściłeś Baskerville-Hall w bardzo młodym wieku?","But you were very young when you last saw Baskerville Hall, were you not?""","After all, you, Sir Henry, left Baskerville-Hall at a very young age?",0.0
514,Mieszka o cztery mile od nas.,"He is an elderly man, red-faced, white-haired, and choleric.",He lives about four miles from us.,0.0
515,"Pożądanem jest, aby spadkobierca sir Karola mógł objąć jaknajprędzej majątek i prowadzić dalej chlubną działalność, przerwaną tak nagle i tak tragicznie. „Gdyby prozaiczne orzeczenie sędziego śledczego i rzeczoznawców nie położyło końca romantycznym historyom, krążącym na temat owej śmierci, nie łatwo byłoby znaleźć właściciela Baskerville Hall.","I had observed some newspaper comment at the time, but I was exceedingly preoccupied by that little affair of the Vatican cameos, and in my anxiety to oblige the Pope I lost touch with several interesting English cases.","It is desirable that Sir Charles's heir may take possession of the estate as soon as possible, and carry on the glorious business so suddenly and so tragically interrupted. ""Had the prosaic ruling of the examining magistrate and the surveyors not put an end to the romantic stories circulating about this death, it would not have been easy to find the owner of Baskerville Hall.",0.0
516,"Widuję chłopaka z zawiniątkiem codziennie, a czasem dwa razy na dzień. Poczekaj pan chwilkę.","I have seen the boy again and again with his bundle. Every day, and sometimes twice a day, I have been able--but wait a moment, Dr. Watson.",I see the boy with the bundle every day and sometimes twice a day. Wait a minute.,0.308
517,"Przez chwilę stałem z kartką w ręku, nie rozumiejąc, co znaczy to uwiadomienie.","For a minute I stood there with the paper in my hands thinking out the meaning of this curt message. It was I, then, and not Sir Henry, who was being dogged by this secret man.","For a moment I stood with the note in my hand, not understanding what the message meant.",0.0
518,"-- Masz swoje pół suwerena; dostaniesz drugie pół, jak mi doniesiesz coś więcej.","""Well, then, here is your half-sovereign. There's another one waiting for you if you can bring any more information.",-- You have your half sovereign; you will get the other half if you report more to me.,0.0
519,"-- Za każdym razem portyer, stojący we drzwiach, wezwie portyera, siedzącego w sieni -- i temu dasz po szylingu.","""In each case the outside porter will send for the hall porter, to whom also you will give a shilling.",-- Each time the portly man standing in the doorway will summon the portly man sitting in the hallway -- and to him you will give a shilling.,0.162
520,"Z wagonu pierwszej klasy wyskoczył mężczyzna krępy, o twarzy wesołej.","We all three shook hands, and I saw at once from the reverential way in which Lestrade gazed at my companion that he had learned a good deal since the days when they had first worked together.",A stocky man with a cheerful face jumped out of the first-class carriage.,0.0
521,Czyżby on pozwalał sir Henrykowi starać się o własną żonę...,"Are you sure of what you say? How could he have permitted Sir Henry to fall in love with her?""",Would that he would allow Sir Henry to seek his own wife....,0.0
522,"Stąpał powoli, zakradał się jakby, wreszcie stanął u drzwi bocznej oficyny.","Looking over, I saw the naturalist pause at the door of an out-house in the corner of the orchard.","He stepped slowly, sneaking as it were, and finally stood at the door of a side outhouse.",0.134
523,"Czy i teraz, łotrze, będziesz przeczył, że dawaliście sobie sygnały?...","Now, you rascal, do you deny that it is a signal?","Will you also now, villain, deny that you have been giving each other signals?....",0.0
524,Pierwszą myślą Stapletona było zapewne zgładzić go ze świata w Londynie.,"""It is possible that Stapleton did not know of the existence of an heir in Canada. In any case he would very soon learn it from his friend Dr. Mortimer, and he was told by the latter all details about the arrival of Henry Baskerville.",Stapleton's first thought was probably to exterminate him from the world in London.,0.0
525,"Ten sam jęk powtórzył się bliżej, dźwięczał w nim strach i ból.","The cry had been loud on account of its vehemence, but it had pealed out from somewhere far off on the shadowy plain. Now it burst upon our ears, nearer, louder, more urgent than before.","The same moan was repeated closer, fear and pain sounding in it.",0.0
526,"-- Tak; po obu stronach biegnie trawnik, szerokości 6 stóp.","""Yes, there is a strip of grass about six feet broad on either side.""","-- Yes; there is a lawn running on both sides, six feet wide.",0.22
