,Sentences_from,Sentences_to,Translated_sentences,BLEU
734,"W maju 2006 roku grupa ekspertów wyruszyła na poszukiwania zwierzęcia, bez rezultatu.","In May 2006, experts were determined to track the animal down.","in may 2006, a group of experts set out to find the animal, to no avail.",0.0
735,"Drury był też zapalonym kolekcjonerem owadów a jego zbiory zawierały ponad 11 000 okazów.Colin Brinded (1946 – 26 listopada 2005) - profesjonalny sędzia snookerowy.Odpowiednikiem jest polski technik.== Wstęp ==W czerwcu 1665 Anglicy pokonali Holendrów w bitwie pod Lowestoft, jednak nie potrafili tego wykorzystać.","Drury was also a prolific collector—his collection comprised over 11,000 specimens.Colin Brinded (1946 – 26 November 2005) was a snooker referee for almost thirty years.*Cohen, A.M., Brawer, F.B.In June 1665 the English had soundly defeated the Dutch in the Battle of Lowestoft, but failed to take advantage of it.","drury was also an avid collector of insects and his collection included over 11,000 specimens. colin brinded (1946 - november 26, 2005) - professional snooker judge. the equivalent is a polish technician. == introduction == in june 1665, the english defeated the dutch at the battle of lowestoft, however, they were unable to take advantage of it.",0.223
736,"Hrabstwo zostało utworzone z Portage w 1846.(21269) Bechini (1996 LG) – planetoida z grupy pasa głównego asteroid okrążająca Słońce w ciągu 3,43 lat w średniej odległości 2,27 j.a.Stolicą prowincji jest miasto Kirkuk.(21311) Servius (1996 XC9) – planetoida z pasa głównego asteroid okrążająca Słońce w ciągu 3,32 lat w średniej odległości 2,23 j.a.: Chevalier d'Eon, Pierre de Beaumarchais, Charles Théveneau de Morande i Louis de Noailles.(21523) GONG (1998 MW15) – planetoida z pasa głównego asteroid okrążająca Słońce w ciągu 5,21 lat w średniej odległości 3 j.a.Odkryta 15 sierpnia 1998 roku.Odkryta 20 sierpnia 1998 roku.Klub ma siedzibę w mieście Kashima, leżącym w Prefekturze Ibaraki.(21602) Ialmenus (1998 YW1) – planetoida z grupy trojańczyków okrążająca Słońce w ciągu 11,8 lat w średniej odległości 5,18 j.a.Odkryta 9 czerwca 1999 roku.Najbardziej popularne to Cata i Coroni.","Its county seat and largest city is Portage.21269 Bechini (1996 LG) is a main-belt asteroid discovered on June 6, 1996 by L. Tesi and A. Boattini at San Marcello Pistoiese.The provincial capital is the city of Kirkuk.21311 Servius (1996 XC9) is a main-belt asteroid discovered on December 4, 1996 by V. S. Casulli at Colleverde di Guidonia.Famous agents included the Chevalier d'Eon, Pierre de Beaumarchais, Charles Théveneau de Morande, and Louis de Noailles.21523 GONG (1998 MW15) is a main-belt asteroid discovered on June 26, 1998 by R. A. Tucker at the Goodricke-Pigott Observatory.The asteroid was discovered on August 15, 1998.The asteroid was discovered on August 20, 1998.Its hometowns are Kashima, Itako, Hasaki and Kamisu, all in Ibaraki Prefecture.21602 Ialmenus (1998 YW1) is a Jupiter Trojan discovered on December 17, 1998 by M. Tichy and Z. Moravec at Klet.The asteroid was discovered on June 9, 1999.The most popular are Cata and Choroni.","the county was formed from portage in 1846. (21269) bechini (1996 lg) - main belt asteroid orbiting the sun for 3.43 years at an average distance of 2.27 a the provincial capital is the city of kirkuk. (21311) servius (1996 xc9 ) - asteroid from the main asteroid belt orbiting the sun in 3.32 years at an average distance of 2.23 au: chevalier d&#39;eon, pierre de beaumarchais, charles théveneau de morande and louis de noailles. (21523) gong (1998 mw15) - main-belt asteroid orbits the sun in 5.21 years at an average distance of 3 au discovered august 15, 1998 discovered august 20, 1998 club is based in kashima, ibaraki prefecture. (21602) ialmenus (1998 yw1) - trojan asteroid orbiting the sun in 11.8 years at an average distance of 5.18 au discovered on june 9, 1999, the most popular are cata and coroni.",0.184
737,"W 1631 Étienne sprzedał swą pozycję drugiego prezydenta ""Cour des Aides"" za sumę 65 665 liwrów.","In 1631 Étienne sold his position as second president of the ""Cour des Aides"" for 65,665 livres.","in 1631 étienne sold his position as second president of the cour des aides for 65,665 livres.",1.0
738,"Sezonowo odbywają się również podróże na linii kolejowej Brunswick - Rockland obsługiwanej przez Maine Eastern Railroad, która dzierżawi linię kolejową Rockland Branch.","Seasonal passenger excursions between Brunswick and Rockland are operated by the Maine Eastern Railroad, which leases the state-owned Rockland Branch rail corridor.","there are also seasonal trips on the brunswick - rockland railroad operated by the maine eastern railroad, which leases the rockland branch railroad.",0.424
739,"Tym razem w grupie przyjaciół obecni są przyjaciółka Andreasa, Carly Simon oraz Mindy Jostyn, Carlos Núñez, Dżiwan Gasparian, XiaoJing Wang i Walter Keiser.","This time, Andreas' friend Carly Simon joins the group, as well as Mind Jostyn, Carlos Nuñez, Djivan Gasparian, XiaoJing Wang and Walter Keiser.","this time, andreas&#39; friend carly simon and mindy jostyn, carlos núñez, dżiwan gasparian, xiaojing wang and walter keizer are present in the group of friends.",0.241
740,"Choć geograficznie odległe od siebie, Polska i Stany Zjednoczone okazały się podobne w tym, jak kształtowały systemy polityczne.","Poland and the United States, though geographically distant, displayed notable similarities in their approaches to the design of political systems.","though geographically distant from each other, poland and the united states turned out to be similar in how they shaped political systems.",0.249
741,"Odkrył ją w 1771 roku Charles Messier.Sennett znalazł się w gronie współzałożycieli New York Institute for Humanities.""What's Up, Doc?","It was discovered by Charles Messier in 1771.He is the founding director of the New York Institute for the Humanities.""What's Up, Doc?","discovered in 1771 by charles messier, sennett was among the co-founders of the new york institute for humanities. &quot;what&#39;s up, doc?",0.318
742,"=== OST (2010) ===W 2010 roku, Yesung wystąpił w tytułowej roli w musicalu ""Hong Gil Dong"", razem z Sungminem, który grał postać historyczną.","===2010: OST===In 2010, Yesung starred in the title role of musical ""Hong Gil Dong"", alongside band mate Sungmin who also played the historical figure Hong Gildong.","=== ost (2010) === in 2010, yesung starred in the title role of the musical &quot;hong gil dong&quot; with sungmin, who played a historical character.",0.322
743,"Liczba mieszkańców w 2000 roku wynosiła 208.Cabool to miasto w Stanach Zjednoczonych, w stanie Missouri.","The median age in the city was 34.3 years.Cabool is a city in Texas County, Missouri, United States.","the population in 2000 was 208. cabool is a city in the united states, missouri.",0.197
744,Jego wewnętrzna granica nie jest ściśle określona ze względu na istnienie dużo jaśniejszego pierścienia głównego i halo.,Its inner boundary is not clearly defined because of the presence of the much brighter main ring and halo.,its inner boundary is not strictly defined due to the existence of a much brighter main ring and a halo.,0.391
745,"Single ""Where Is the Love?W 2002 r. grupa The Moldy Peaches rozpadła się, a Green skupił się na swojej solowej karierze.","The singles ""Where Is The Love?In 2002, the Moldy Peaches went on hiatus, and both Green and Dawson embarked on solo careers.","single &quot;where is the love?&quot; in 2002, the moldy peaches broke up, and green focused on his solo career.",0.146
746,"===2009===W 2009 roku, Valverde osiągnął swój największy sukces – triumfował w Vuelta a España.Herbert Lawrence Block (""Herblock"") (ur.Dotarł do ćwierćfinałów Northern Ireland Trophy 2006 oraz do finału Malta Cup 2007 gdzie przegrał z Shaunem Murphy.","On 20 September 2009, Valverde clinched the overall victory in the 2009 Vuelta a España."" Simon and Schuster, (1968)*""Straight Herblock.Day reached the quarter-finals of the 2006 Northern Ireland Trophy and was runner up in the 2007 Malta Cup, losing 4–9 to Shaun Murphy.","=== 2009 === in 2009, valverde achieved his greatest success - he triumphed in vuelta a españa. herbert lawrence block (&quot;herblock&quot;) (born. he reached the northern ireland trophy 2006 quarterfinals and the 2007 malta cup final where he lost to shaun murphy.",0.144
747,"W 1919 Leonard Woolf został redaktorem ""International Review"" i redagował dział międzynarodowy ""Contemporary Review"" (1920–1922).","In 1919 Woolf became editor of the ""International Review"", and edited the international section of the ""Contemporary Review"" (1920–22).",in 1919 leonard woolf became editor of the international review and edited the international section of the contemporary review (1920–1922).,0.822
748,Obecnym królem jest Karol XVI Gustaw.,The current monarch is Carl XVI Gustaf.,the current king is charles xvi gustaf.,0.0
749,"Elity nie muszą już dłużej bać się śmierci, a młodzi nie mogą liczyć na zastąpienie elit.""Differences between the mechanism of action of MDMA, MBDB, and the classic hallucinogens.Mars Express – bezzałogowa misja kosmiczna Europejskiej Agencji Kosmicznej (ESA), której celem jest badanie Marsa.","No longer do the elite fear death, and no longer can the young hope to replace them.""Differences between the mechanism of action of MDMA, MBDB, and the classic hallucinogens.Mars Express is a space exploration mission being conducted by the European Space Agency (ESA).","the elites no longer have to fear death, and the young cannot count on replacing the elites. &quot;differences between the mechanism of action of mdma, mbdb, and the classic hallucinogens. mars express - an unmanned space mission of the european space agency (esa) is the study of mars.",0.354
750,"Miejscowość przecinają drogi międzystanowe 90 i 39, droga US 20 i US 51.","The village is served by Interstate 90, Interstate 39, U.S. Route 20 and U.S. Route 51.","the town is crossed by interstates 90 and 39, us 20 and us 51.",0.0
751,"Produkcja rozpoczęła się w 1941 w fabryce znajdującej się na Badger Avenue 285 w Clinton Hill, NNewark, New Jersey.","Production began in 1941 in a factory located at 285 Badger Avenue in Clinton Hill, Newark, New Jersey.","production began in 1941 at a factory located at 285 badger avenue in clinton hill, nnewark, new jersey.",0.69
752,"Ale przez limit na obcokrajowców był zmuszony grać na wypożyczeniu w klubach AC Bellinzona, Górnik Zabrze i FC Chiasso.W 1950 został wysłany wraz z Janem Karolem do Hiszpanii.","After that he played on loan for Swiss AC Bellinzona, Polish Górnik Zabrze and Swiss FC Chiasso.In 1950 he and his brother Juan Carlos were sent to study in Spain.","but due to the limit of foreigners he was forced to play on loan at ac bellinzona, górnik zabrze and fc chiasso clubs. in 1950 he was sent with jan karol to spain.",0.0
753,=== Centrum miasta ===Stary Stavanger (Gamle Stavanger) znajduje się tuż obok centrum miasta i posiada kolekcję XVIII i XIX-wiecznych konstrukcji drewnianych.,===City centre===Old Stavanger (Gamle Stavanger) is located right next to the city centre and has a collection of 18th- and 19th-century wooden structures.,=== city center === old stavanger (gamle stavanger) is just outside the city center and has a collection of 18th and 19th century wooden structures.,0.413
754,"Stolicą regionu jest Tanger.Black Stone Cherry - amerykańska grupa muzyczna grająca południowego rocka, założona 4 czerwca 2001 w Edmonton.","The capital is Tangier.Black Stone Cherry is an American rock band, formed in 2001 in Edmonton, Kentucky.","the capital of the region is tanger.black stone cherry - an american music group playing southern rock, founded on june 4, 2001 in edmonton.",0.0
755,"Przedział wiekowy populacji hrabstwa kształtuje się następująco: 24,40% osób poniżej 18 roku życia, 11,90% pomiędzy 18 a 24 rokiem życia, 26,20% pomiędzy 25 a 44 rokiem życia, 21,70% pomiędzy 45 a 64 rokiem życia oraz 15,90% osób powyżej 65 roku życia.","In the county the population was spread out with 24.40% under the age of 18, 11.90% from 18 to 24, 26.20% from 25 to 44, 21.70% from 45 to 64, and 15.90% who were 65 years of age or older.","the age range of the county&#39;s population is 24.40% under 18, 11.90% between 18 and 24, 26.20% between 25 and 44, 21.70% between 45 and 64 and 15.90% of people over 65 years of age.",0.133
756,Forty-five Pen-and-Ink Drawings by Louis Wain.,Forty-five Pen-and-Ink Drawings by Louis Wain.,forty-five pen-and-ink drawings by louis wain.,1.0
757,": Широки леса и поля,: Славься, Родина моя!",":Широки леса и поля,:Славься, Родина моя!",": wide forests and fields: glory, my motherland!",0.0
758,"Wiele lat po premierze ""Degrassi"" w 1990 r. Aaron Spelling wyprodukował ""Beverly Hills, 90210"".XX wieku.Tarantula - pierwszy singel zespołu Smashing Pumpkins z ich szóstej płyty Zeitgeist.","In 1990, Darren Star created ""Beverly Hills, 90210"" along with famous producer Aaron Spelling.J.-L.J.""Tarantula"" is a song by The Smashing Pumpkins.","years after the release of &quot;degrassi&quot; in 1990, aaron spelling produced &quot;beverly hills, 90210&quot; of the 20th century. tarantula - smashing pumpkins&#39; first single from their sixth album zeitgeist.",0.0
759,"w tomografach firmy Picker PQ5000 jest 4800 detektorów).Został odkryty w 1878 r. przez Jean Charles Galissard de Marignaca.DTI – diffusion tensor imaging""), które może być zaadaptowane do obrazowania zmian w połączeniach istoty białej, oraz obrazowanie zależne od dyfuzji (""ang.Utwór brzmiał niemal jak religijna pieśń pochwalna, a jego styl muzyczny był podobny do hymnów innych europejskich monarchii.","In the U.S., the first installation was at the Mayo Clinic.==History==Ytterbium was discovered by the Swiss chemist Jean Charles Galissard de Marignac in the year 1878.The recent development of diffusion tensor imaging (DTI) enables diffusion to be measured in multiple directions and the fractional anisotropy in each direction to be calculated for each voxel.The song resembled a hymn, and its musical style was similar to that of other anthems used by European monarchs.","there are 4,800 detectors in picker pq5000 scanners). it was discovered in 1878 by jean charles galissard de marignac. dti - diffusion tensor imaging &quot;), which can be adapted to imaging changes in white matter connections, and diffusion-dependent imaging (&quot; the piece sounded almost like a religious song of praise and its musical style was similar to the hymns of other european monarchies.",0.176
760,"1887* 1973:** Lex Barker, amerykański aktor (zm.","1948)*1973 – Lex Barker, American actor (b.","1887 * 1973: ** lex barker, american actor (d.",0.411
761,"Tekst jest pisany małą uncjałą w dwóch kolumnach na stronę, 24 linijek w kolumnie.","It is written in two columns per page, 24 lines per page, in small uncial letters.","the text is in a small ounce in two columns per page, 24 lines per column.",0.48
762,"Krkić został uhonorowany nagrodą Bronze Ball (Brązowa Piłka) dla trzeciego najlepszego zawodnika turnieju, a wyprzedzili go Macauley Chrisantus (Silver Ball) i Toni Kroos (Golden Ball).","Because of his performances, Bojan was given the Adidas Bronze Ball, naming him the third best player in the tournament, behind Macauley Chrisantus (silver) and Toni Kroos (gold).","krkić was honored with the bronze ball (bronze ball) award for the tournament&#39;s third best player, followed by macauley chrisantus (silver ball) and toni kroos (golden ball).",0.0
763,"Drugie północno-wschodnie wyjście posiada drzwi przy Drottninggatan, Sergels torg 16 i Klarabergsgatan 48.","The second entrance (TCE N) is located to the northeast, and its doors are located at Drottninggatan, Sergels torg 16 and Klarabergsgatan 48.","the other northeast exit has a door at drottninggatan, sergels torg 16 and klarabergsgatan 48.",0.315
764,"===Demografia===Według spisu z 2000 roku wioskę zamieszkuje 481 osób skupionych w 212 gospodarstwach domowych, tworzących 132 rodzin.","==Demographics==As of the census of 2000, there were 481 people, 212 households, and 132 families residing in the village.","=== demographics === as of the census of 2000, the village was inhabited by 481 people, 212 households, and 132 families.",0.531
765,Swoją trzecią książkę Darwin ukończył w 1846.,Darwin completed his third geological book in 1846.,darwin completed his third book in 1846.,0.5
766,"1937)* 1973:** Noël Coward, brytyjski dramaturg, kompozytor, aktor, scenarzysta filmowy (ur.","1937)*1973 – Noël Coward, English actor, director, playwright, and composer (b.","1937) * 1973: ** noël coward, british playwright, composer, actor, film screenwriter (b.",0.0
767,"Pod względem zaludnienia Tibro jest 204. gminą w Szwecji.W gminie zameldowanych jest 330 cudzoziemców.Gmina położona jest w regionie Västra Götaland, siedzibą jej władz jest Töreboda.","Its seat is located in the town of Tibro.It is located in the province of Bohuslän.Töreboda Municipality (""Töreboda kommun"") is a municipality in Västra Götaland County in western Sweden.","in terms of population, tibro is the 204th municipality in sweden. 330 foreigners are registered in the municipality. the municipality is located in the västra götaland region and its seat is töreboda.",0.152
768,* Kevin Keelan (1963–80)* Ian Culverhouse (1985–94)* Steve Bruce (1984–87)* Duncan Forbes (1968–81)* Mark Bowen (1987–96)* Darren Huckerby (2003–08)* Ian Crook (1986–97)* Martin Peters (1975–80)* Darren Eadie (1993–99)* Chris Sutton (1991–94)* Iwan Roberts (1997–2004)=== Gracz roku w klubie ====== Inne sekcje sportowe ===Norwich City posiada także inną sekcję – sekcję piłki nożnej kobiecej.Fulham Football Club (wymowa: /ˈfʊləm/) – angielski klub piłkarski mający siedzibę w Londynie w dzielnicy Hammersmith and Fulham założony w 1879 roku.,"* Kevin Keelan (1963–80)* Ian Culverhouse (1985–94)* Steve Bruce (1984–87)* Duncan Forbes (1968–81)* Mark Bowen (1987–96)* Darren Huckerby (2003–08)* Ian Crook (1986–97)* Martin Peters (1975–80)* Darren Eadie (1993–99)* Chris Sutton (1991–94)* Iwan Roberts (1997–2004)===Players of the Year===:""For a more detailed list of these winners of the Barry Butler trophy, see Norwich City Players of the Year.Fulham Football Club is a professional football club based in Fulham, London Borough of Hammersmith and Fulham, southwest London.","* kevin keelan (1963–80) * ian culverhouse (1985–94) * steve bruce (1984–87) * duncan forbes (1968–81) * mark bowen (1987–96) * darren huckerby (2003–08) * ian crook (1986–97) * martin peters (1975–80) * darren eadie (1993–99) * chris sutton (1991–94) * ivan roberts (1997–2004) === club player of the year ===== = other sports sections === norwich city also has another section, a women&#39;s soccer section. fulham football club (pronounced / ˈfʊləm /) is an english football club based in london in hammersmith and fulham, founded in 1879.",0.493
769,": Arizona Science Center, Hall of Flame Firefighting Museum, Phoenix Museum of History, Pueblo Grande Museum and Cultural Park oraz Children's Museum of Phoenix.","They include the Phoenix Art Museum, Arizona Capitol Museum, Arizona Military Museum, Hall of Flame Firefighting Museum, the Pueblo Grande Museum and Cultural Park, Children's Museum of Phoenix, Arizona Science Center, and the Heard Museum.",": arizona science center, hall of flame firefighting museum, phoenix museum of history, pueblo grande museum and cultural park oraz children's museum of phoenix.",0.34
770,"1929)** Elsa Lanchester, brytyjska aktorka (ur.","1895)*1986 – Elsa Lanchester, English-American actress and singer (b.","1929) ** elsa lanchester, british actress (b.",0.0
771,"Ten projekt był dyskutowany na szczycie w Narrabri, w Nowej Południowej Walii pierwszego grudnia 2006 roku.","This project was discussed at a summit in Narrabri, NSW on 1 December 2006.","this project was discussed at the narrabri, new south wales summit on december 1, 2006.",0.301
772,"* ""Die Sorben in Deutschland"", pod red.","* ""Die Sorben in Deutschland"", pod red.","* &quot;the sorbs in germany&quot;, pod red.",0.0
773,"== Sąsiednie gminy ==Bochnia, Borzęcin, Dębno, Gnojnik, Nowy Wiśnicz, Rzezawa, SzczurowaSiedziba gminy to Brzeszcze, oprócz tego, w jej skład wchodzą: Jawiszowice, Przecieszyn, Skidziń, Wilczkowice, Zasole.== Sołectwa ==Aleksandrowo, Brzezie, Falborz, Guźlin, Jaranówek, Jądrowice, Kąkowa Wola, Kąty, Kuczyna, Machnacz, Miechowice, Miechowice Nowe, Pikutkowo, Redecz Krukowy, Rzadka Wola, Rzadka Wola-Parcele, Słone, Sokołowo, Sokołowo-Kolonia, Stary Brześć, Wieniec, Wieniec-Zalesie, Witoldowo, Wolica.== Demografia ==Dane z 30 czerwca 2004:== Miejscowości ==Brzozów, Górki, Grabownica Starzeńska, Humniska, Przysietnica, Stara Wieś, Turze Pole, Zmiennica.","==Neighbouring gminas==Gmina Brzesko is bordered by the gminas of Bochnia, Borzęcin, Dębno, Gnojnik, Nowy Wiśnicz, Rzezawa and Szczurowa.==Villages==Apart from the town of Brzeszcze, Gmina Brzeszcze contains the villages and settlements of Jawiszowice, Przecieszyn, Skidziń, Wilczkowice and Zasole.==Villages==Apart from the town of Brześć Kujawski, Gmina Brześć Kujawski contains the villages and settlements of Aleksandrowo, Brzezie, Falborek, Falborz, Falborz-Kolonia, Gustorzyn, Guźlin, Jądrowice, Jaranówek, Kąkowa Wola, Kąkowa Wola-Parcele, Kąty, Kuczyna, Machnacz, Miechowice, Miechowice Duże, Parcele Sokołowskie, Pikutkowo, Redecz Krukowy, Rzadka Wola, Rzadka Wola-Parcele, Słone, Sokołowo-Kolonia, Starobrzeska Kolonia, Stary Brześć, Wieniec, Wieniec-Zalesie, Wieniec-Zdrój, Witoldowo and Wolica.==Villages==Apart from the town of Brzozów, Gmina Brzozów contains the villages and settlements of Górki, Grabownica Starzeńska, Humniska, Stara Wieś, Turze Pole, Wola Górecka and Zmiennica.","== neighboring communes == bochnia, borzęcin, dębno, gnojnik, nowy wiśnicz, rzezawa, szczurowa the seat of the commune is brzeszcze, in addition, it consists of: jawiszowice, przecieszyn, skidziń, wilczkowice, zasole. , falborz, guźlin, jaranówek, jądrowice, kąkowa wola, kąty, kuczyna, machnacz, miechowice, miechowice nowe, pikutkowo, redecz krukowy, rzadka wola, rzadka wola-parcele, salt, sokołowo, sokołowo-kolonia, stary brest, wieniec, wieniec -zalesie, witoldowo, wolica. == demographics == data from june 30, 2004: == towns == brzozów, górki, grabownica starzeniaska, humniska, przysietnica, stara wieś, turze pole, zmiennica.",0.2
774,"1930)** Maurice Sendak, amerykański pisarz (ur.","1962)* 2012 – Maurice Sendak, American author and illustrator (b.","1930) ** maurice sendak, american writer (b.",0.0
775,"Sainte Marie-du-Mont is shown in the right lower middle, next to Drop Zone C. The battery at Brécourt Manor is marked in red directly above the village.24 września 1972) - amerykański muzyk, lider zespołu Eagles of Death Metal.Mieszka w Sugar Land w Teksasie z żoną i trójką dzieci.Wastek (Huastek) – majański język używany w Meksyku przez lud Huasteków, żyjący na wiejskich terenach San Luis Potosí oraz północnego Veracruz.","Sainte Marie-du-Mont is shown in the right lower middle, next to Drop Zone C. The battery at Brécourt Manor is marked in red directly above the village.He is known as the frontman of the California-based rock band, Eagles of Death Metal.He currently lives in Sugar Land, Texas with his wife and three children.The Wasteko (Huasteco) language is a Mayan language of Mexico, spoken by the Huastecos living in rural areas of San Luis Potosí and northern Veracruz.","sainte marie-du-mont is shown in the right lower middle, next to drop zone c. the battery at brécourt manor is marked in red directly above the village (september 24, 1972) - american musician, leader of the band eagles of death metal. in sugar land, texas with his wife and three children. wastek (huastek) - a mayan language spoken in mexico by the huastek people, living in the rural areas of san luis potosí and northern veracruz.",0.605
776,"Wiktoria zamieszkała wtedy w swoim własnym domu w Coppins, Iver, Buckinghamshire.","The Princess then set up her own home at Coppins, Iver, in Buckinghamshire.","victoria then moved to her own home in coppins, iver, buckinghamshire.",0.0
