,Sentences_from,Sentences_to,Translated_sentences,BLEU
229,"Następnie Raquel poznała Juana Luisa Suáreza i razem z Davidem Feito założyli zaspół ""El Sueño de Morfeo"".W latach 1777 - 1873 był podstawową walutą Szwecji.","Soon after Raquel and David met Juan Luis Suárez, and the three created ""El Sueño de Morfeo"".Between 1777 and 1873, it was the currency of Sweden.",then raquel met juan luis suárez and together with david feito they founded &quot;el sueño de morfeo&quot;. from 1777 to 1873 it was the main currency of sweden.,0.281
230,"W roku 2005 po wygraniu trzeciej ligi klub awansował do drugiej ligi Campeonato Brasileiro.12 listopada 1981 w Rotenburg an der Fulda) – niemiecka lekkoatletka, specjalizująca się w skoku o tyczce.","In 2005, the club was promoted to the second division after winning the third division.Annika Becker (born 12 November 1981 in Rotenburg an der Fulda) is a retired German pole vaulter.","in 2005, after winning the third league, the club was promoted to the second division of campeonato brasileiro (november 12, 1981 in rotenburg an der fulda) - a german athlete, specializing in pole vault.",0.459
231,W 1998 roku Psychosis dołączył do założonej przez Eddiego Guerrero grupy - Latino World Order (LWO).,"In 1998, Psychosis joined Eddy Guerrero's Latino World Order (LWO) group, which consisted entirely of Mexican wrestler.","in 1998, psychosis joined the group founded by eddie guerrero - latino world order (lwo).",0.295
232,"Pisarz ""Hollywood Reporter Sophie Schillaci"" stwierdził, że ""ma głos, który może uciszyć nawet najsurowszych krytyków.== Biografia ==Urodził się w Empoli w Toskanii jako Dante Michelangelo Benvenuto Ferruccio Busoni, jako jedyne dziecko rodziców-muzyków.","""The Hollywood Reporter"" writer Sophie Schillaci stated she ""has a voice that can silence even the harshest of critics.==Biography==Ferruccio Busoni was born in the Tuscan town of Empoli, Italy, the only child of two professional musicians.","hollywood reporter writer sophie schillaci said he &quot;has a voice that can silence even the harshest critics. == biography == he was born in empoli, tuscany as dante michelangelo benvenuto ferruccio busoni, the only child of his musician parents.",0.382
233,"1620)* 1721 – Rudolf Jakob Camerarius, niemiecki lekarz, botanik (ur.","1596)*1721 – Rudolf Jakob Camerarius, German botanist and physician (b.","1620) * 1721 - rudolf jakob camerarius, german physician, botanist (b.",0.302
234,Berlinghieri przedstawił na nim Chrystusa w sposób typowy dla sztuki bizantyjskiej – Christus triumphans.Dostępny jest niebiesko znakowanym szlakiem turystycznym z miejscowości Kuchyňa lub ze schroniska turystycznego Zochova chata.,"He was the father of the painters Barone Berlinghieri, Bonaventura Berlinghieri, and Marco Berlinghieri.==Approach==Usual points of departure for a one day trip are Zochova chata and Kuchyňa.",berlinghieri depicted christ in a manner typical of byzantine art - christus triumphans. it is accessible via the blue marked hiking trail from kuchyňa or from the tourist chalet zochova chata.,0.0
235,Wkrótce w Londynie zjawił się Jay Sebring nalegając na spotkanie z Polańskim.,Jay Sebring traveled to London where he insisted on meeting Polanski.,soon jay sebring appeared in london insisting on a meeting with polanski.,0.0
236,"W czasach Kassandra Pella została rozbudowana według planu hippodamejskiego.Orkiestrami Maggio Musicale Fiorentino i Teatro dell'Opera di Roma dyrygował Zubin Mehta.""Bánffyhunyad"") – miasto w zachodniej Rumunii, w okręgu Kluż.Burnt Offerings – trzeci album zespołu Iced Earth.Młode małżeństwo zamieszkało w pałacu Noordeinde w Hadze.","On the site of the ancient city of Pella is the Archaeological Museum of Pella.Zubin Mehta conducted the orchestra of Maggio Musicale Fiorentino and the orchestra of Teatro dell'Opera di Roma.Huedin (, ; ; ) is a town in Cluj County, Romania.Burnt Offerings is the third studio album by American heavy metal band Iced Earth.The young couple went to live at Noordeinde Palace in The Hague.","in kassandro&#39;s time, pella was expanded according to the hippodamaic plan. the maggio musicale fiorentino and teatro dell&#39;opera di roma orchestras were conducted by zubin mehta. &quot;bánffyhunyad&quot; - a city in western romania, in the cluj district. burnt offerings - the third album of iced earth. lived at the noordeinde palace in the hague.",0.129
237,"W 1908 roku zaprezentował całość swoich prac przed ""Royal College of Physicians"" w wykładzie zatytułowanym ""Inborn Errors of Metabolism"" (""Wrodzone wady metabolizmu""), który został opublikowany w roku 1909.","In 1908, the core of this work was presented as the Croonian Lectures to the Royal College of Physicians, entitled Inborn Errors of Metabolism and published the following year.","in 1908, he presented all of his work to the royal college of physicians in a lecture entitled &quot;inborn errors of metabolism&quot;, which was published in 1909.",0.22
238,"Charles I and the Scottish Troubles, 1637–1641"", 1990.","Charles I and the Scottish Troubles, 1637–1641"", 1990.","charles i and the scottish troubles, 1637–1641"", 1990.",1.0
239,"Zdjęcia zrealizowano w warszawskim klubie Proxima 15 czerwca 2001 roku.: מועדון הכדורגל מכבי חיפה, ""Moadon HaKaduregel Maccabi Haifa"") jest izraelskim klubem piłkarskim z Hajfy.Odbudowa została oficjalnie zakończona w 2001.Leo Strauss (ur.Tour Generación 2006Tour Generación 2006 to druga trasa koncertowa zespołu RBD.","It was filmed at Proxima Club in Warsaw, Poland, on June 15, 2001.Maccabi Haifa Football Club (, ""Moadon HaKaduregel Maccabi Haifa"") is an Israeli professional football club, based in Kiryat Eliezer, City of Haifa, a section of Maccabi Haifa sports club.It was officially completed in 2001.J. Harvey Lomax.;""RBD Tour Brasil 2006""RBD did a stadium tour through Brazil.","the photos were taken in the proxima club in warsaw on june 15, 2001: מועדון הכדורגל מכבי חיפה, &quot;moadon hakaduregel maccabi haifa&quot;) is an israeli football club from haifa. the reconstruction was officially completed in 2001. leo strauss (born: tour generación 2006tour generación 2006tour generación 2006tour generación 2006 concert tour of the rbd band.",0.139
240,"23 kwietnia 1983 roku Laibach zadebiutował w telewizji w programie informacyjno-publicystycznym TV Tednik, co wywołało negatywne reakcje władz – zabroniono występowania członkom grupy na koncertach i używania niemieckiej nazwy Laibach.","The subsequent debut television appearance on June 23, 1983, in the informative-political program ""TV Tednik"", caused major negative reactions after which they were banned from using the name Laibach as well as performing in public.","on april 23, 1983, laibach made his debut on television in the news and publicity program tv tednik, which caused negative reactions from the authorities - members of the group were forbidden to perform at concerts and use the german name laibach.",0.0
241,"== Geografia ==Według spisu hrabstwo zajmuje powierzchnię 730 km², z czego 728 km² stanowią lądy, a 2 km² (0,24%) stanowią wody.","==Geography==According to the U.S. Census Bureau, the county has a total area of , of which is land and (0.5%) is water.","== geography == according to the census, the county covers an area of 730 km², of which 728 km² is land and 2 km² (0.24%) is water.",0.0
242,W kwietniu 2009 EMC2 uzyskało kolejne 2 miliony USD w ramach ustawy American Recovery and Reinvestment Act 2009.,"In April 2009, the DoD published a plan to provide Polywell a further $2 million in funding as part of the American Recovery and Reinvestment Act of 2009.","in april 2009, emc2 received another $ 2 million under the american recovery and reinvestment act 2009.",0.233
243,"Ascella znajduje się 90 ly od Ziemi.Jej siedziba mieści się w Londynie, posiada także biuro w Los Angeles.The Firm - angielska supergrupa rockowa, której skład tworzyli były wokalista zespołów Free i Bad Company - Paul Rodgers, były gitarzysta Led Zeppelin – Jimmy Page, basista Tony Franklin, oraz były perkusista zespołu Uriah Heep – Chris Slade.","It has the traditional name Ascella.The company also has other offices located in Los Angeles and Ireland.The Firm were a British rock supergroup comprising former Free and Bad Company singer Paul Rodgers, guitarist Jimmy Page formerly of The Yardbirds and Led Zeppelin, and Manfred Mann's Earth Band and Uriah Heep drummer Chris Slade and bass player Tony Franklin.","ascella is 90 ly from earth and is based in london and has an office in los angeles. the firm is an english rock supergroup made up of former free and bad company singer paul rodgers and former led zeppelin guitarist jimmy page , bassist tony franklin, and former uriah heep drummer chris slade.",0.261
244,"* ""Trois réformateurs : Luther, Descartes, Rousseau, avec six portraits"", Paris, Plon, 1925* ""Réponse à Jean Cocteau"", 1926* ""Une opinion sur Charles Maurras et le devoir des catholiques"", Paris, Plon, 1926* ""Primauté du spirituel"", 1927* ""Pourquoi Rome a parlé"" (coll.","* ""Trois réformateurs : Luther, Descartes, Rousseau, avec six portraits"", Paris , 1925* ""Réponse à Jean Cocteau"", 1926* ""Une opinion sur Charles Maurras et le devoir des catholiques"", Paris , 1926* ""Primauté du spirituel"", 1927* ""Pourquoi Rome a parlé"" (coll.","* &quot;three reformers: luther, descartes, rousseau, with six portraits&quot;, paris, plon, 1925 * &quot;response to jean cocteau&quot;, 1926 * &quot;an opinion on charles maurras and the duty of the catholics&quot;, paris, plon, 1926 * &quot;primacy of the spiritual&quot;, 1927 * &quot;why rome spoke&quot; (coll.",0.0
245,"Woodbury, N.Y.: Barron’s Educational Series, 1979.","Wo odbury, N.Y.: Barron's Educational Series, 1979.","woodbury, n.y.: barron’s educational series, 1979.",0.0
246,Nazwa Łabiszyn pochodzi prawdopodobnie od księcia Łabiszy.,The name Łabiszyn originates probably from the prince Łabiszy.,the name łabiszyn probably comes from the prince łabisza.,0.0
247,"Str.W 1504 odziedziczył tytuł księcia de Guise.Jagienna – część wsi Domaradz w Polsce położona w województwie opolskim, w powiecie namysłowskim, w gminie Pokój.Żabiniec – część wsi Domaradz w Polsce położony w województwie opolskim, w powiecie namysłowskim, w gminie Pokój.W lecie 1996 roku, w czasie okienka transferowego, przeszedł na zasadzie wolnego transferu do AS Monaco.""Claude de Lorraine"" (20 października 1496, w Condé-sur-Moselle - 12 kwietnia 1550, w Joinville) - pierwszy książę de Guise w latach 1528-1550.","Pg.He succeeded as Count of Guise in 1504.Jagienna is a village in the administrative district of Gmina Pokój, within Namysłów County, Opole Voivodeship, in south-western Poland.Żabiniec is a village in the administrative district of Gmina Pokój, within Namysłów County, Opole Voivodeship, in south-western Poland.Collins moved to AS Monaco in the summer of 1996 on a free transfer under the Bosman ruling.Claude de Lorraine, duc de Guise (20 October 1496, Château de Condé-sur-Moselle, – 12 April 1550, Château de Joinville) was a French aristocrat and general.","str. w 1504 inherited the title of duke de guise.jagienna - part of the village of domaradz in poland, located in the opole voivodeship, in the namysłów poviat, in the commune of pokoj.żabiniec - part of the village of domaradz in poland, located in the opolskie voivodeship, in the poviat of namyslowski, in the commune of peace. in the summer of 1996, during the transfer window, he was transferred on a free transfer to as monaco. &quot;claude de lorraine&quot; (october 20, 1496, in condé-sur-moselle - april 12, 1550, in joinville) - the first duke de guise in the years 1528-1550.",0.115
248,"James Strachey, 1933)* ""Spectatorial Essays"" (ed.","James Strachey (1933)* ""Spectatorial Essays"", ed.","james strachey, 1933)* ""spectatorial essays"" (ed.",1.0
249,"Z opactwa Woburn napisała do Henryka list załączając skrwawioną szatę zabitego w bitwie, króla Szkocji Jakuba IV, którą Henryk użył jako sztandaru podczas oblężenia Tournai.W 1963 roku ponownie wyjechała do Anglii, gdzie podjęła pracę bibliotekarki w londyńskim ""Foreign and Commonwealth Office"".Wcześniej, w 1971 roku poddała się aborcji.","From Woburn Abbey she sent a letter to Henry along with a piece of the bloodied coat of King James IV of Scotland, who died in the battle, for Henry to use as a banner at the siege of Tournai.In 1963, Adcock returned to England and took up a post as an assistant librarian at the Foreign and Commonwealth Office in London until 1979.They don't see the emotions, the downs...","from woburn abbey, she wrote a letter to henry, attaching the bloodied robe of king james iv of scotland, killed in battle, which henry used as a banner during the siege of tournai. in 1963, she returned to england, where she took a job as a librarian at the london &quot;foreign and commonwealth office&quot;. , in 1971 she had an abortion.",0.22
250,W tym samym roku pojawił się model Prinz 1000 i pochodne takie jak TT i TT/S.,In the same year Prinz 1000 and derivatives like the TT and TT/S followed.,"in the same year, the prinz 1000 model and derivatives such as the tt and tt / s appeared.",0.235
251,== Książki autorstwa Davida Irvinga ==* The Destruction of Dresden (1963)* The Mare’s Nest (1964)* The Virus House (1967)* The Destruction of Convoy PQ17* Accident - The Death of General Sikorski (1967)* Breach of Security (1968)* The Rise and Fall of the Luftwaffe (1973)* Hitler’s War (1977)* The Trail of the Fox (1977)* The War Path (1978)* The War Between the Generals (1981)* Uprising!Hamann był też muzykiem (grał na lutni).W 1948 została członkiem St Anne's College w Oksfordzie.,"==Bibliography=====Books===* ""The Destruction of Dresden"" (1963) ISBN 0-7057-0030-5* ""The Mare's Nest"" (1964)* ""The Virus House"" (1967)* ""The Destruction of Convoy PQ17"" (1967)* ""Accident – The Death of General Sikorski"" (1967) ISBN 0-7183-0420-9* ""Breach of Security"" (1968) ISBN 0-7183-0101-3* ""The Rise and Fall of the Luftwaffe"" (1973), a biography of Erhard Milch ISBN 0-316-43238-5* ""Hitler's War"" (1977)* ""The Trail of the Fox"" (1977), a biography of Erwin Rommel ISBN 0-525-22200-6* ""The War Path"" (1978) ISBN 0-670-74971-0* ""The War Between the Generals"" (1981)* ""Uprising!==Influences on Hamann==Hamann was greatly influenced by David Hume.In 1948, she became a fellow of St Anne's College, Oxford.",== książki autorstwa davida irvinga ==* the destruction of dresden (1963)* the mare’s nest (1964)* the virus house (1967)* the destruction of convoy pq17* accident - the death of general sikorski (1967)* breach of security (1968)* the rise and fall of the luftwaffe (1973)* hitler’s war (1977)* the trail of the fox (1977)* the war path (1978)* the war between the generals (1981)* uprising!hamann był też muzykiem (grał na lutni).w 1948 została członkiem st anne's college w oksfordzie.,0.414
252,""" (razem z W. G. Lohrmannem i innymi), J.",""" (with W. G. Lohrmann and others), J.","&quot;(together with wg lohrmann et al.), j.",0.0
253,Transactions of the Geological Society of South Africa.,Transactions of the Geological Society of South Africa.,transactions of the geological society of south africa.,1.0
254,Zaaresztowano go ponownie w 1959 i skazano na 25 lat.,He was arrested again in 1959 and sentenced to 25 years.,he was arrested again in 1959 and sentenced to 25 years.,1.0
255,") – król Amalekitów.* Sweet Emotion zostało nagrane przez Leo Kottke i Mike'a Gordona, oraz grupy The Answer, Warrant i Ratt.","xiii.).""Sweet Emotion"" has been covered by Leo Kottke and Mike Gordon, The Answer, Warrant and Ratt.",") king of the amalekites. * sweet emotion was recorded by leo kottke and mike gordon, and the groups the answer, warrant and ratt.",0.373
256,"Matthews, który dorastał w Hanley , był praktykantem w klubie, po raz pierwszy wystąpił marca 1932 r., w meczu przeciwko Bury, w wieku 17 lat.","Matthews, who grew up in Hanley, was an apprentice at the club and made his first appearance in March 1932, against Bury, at the age of 17.","matthews, who grew up in hanley, was an apprentice with the club, making his first appearance in march 1932 in a match against bury at the age of 17.",0.648
257,"CAD, Geospatial, GeoVRML, Humanoid animation, NURBS itp.","CAD, Geospatial, Humanoid animation, NURBS etc.","cad, geospatial, geovrml, humanoid animation, nurbs itp.",0.0
258,"W spisanych 50 lat później pamiętnikach Barney napisała: ""Ona nie mogła być uratowana.","In a memoir written fifty years later Barney said ""She could not be saved.","in her memoirs written 50 years later, barney wrote: &quot;she could not be saved.",0.274
259,"Przedział wiekowy populacji hrabstwa kształtuje się następująco: 30,20% osób poniżej 18 roku życia, 7,10% pomiędzy 18 a 24 rokiem życia, 33,50% pomiędzy 25 a 44 rokiem życia, 21,30% pomiędzy 45 a 64 rokiem życia oraz 8,00% osób powyżej 65 roku życia.","In the county the population was spread out with 30.20% under the age of 18, 7.10% from 18 to 24, 33.50% from 25 to 44, 21.30% from 45 to 64, and 8.00% who were 65 years of age or older.","the age range of the county&#39;s population is as follows: 30.20% of those under the age of 18, 7.10% between the ages of 18 and 24, 33.50% between the ages of 25 and 44, 21.30% between the ages of 45 and 64 and 8.00% of people over 65 years of age.",0.187
260,"Pomimo ostrej zawodowej rywalizacji Cope również przypisał gatunek rodzajowi ""Coelurus""; w 1887 nazwał późnotriasowe szczątki z Nowego Meksyku ""C. bauri"" i ""C. longicollis"".","Despite their professional animosity, Cope also assigned species to ""Coelurus""; in 1887, he named fossils from the Late Triassic of New Mexico as ""C. bauri"" and ""C. longicollis"".","despite fierce professional competition, cope also assigned a species to the genus &quot;coelurus&quot;; in 1887 he named the late triassic remains from new mexico &quot;c. bauri&quot; and &quot;c. longicollis&quot;.",0.184
261,Ogromny pożar w roku 1547 zniszczył ponad 70 domów.,A major fire in 1547 destroyed more than 70 houses.,a huge fire in 1547 destroyed more than 70 houses.,0.783
262,"(Ostfildern:) Jan Thorbecke Verlag, 2008 (Tübinger Bausteine zur Landesgeschichte, 10), 355 – 395.Maestlin studiował w Tübinger Stift teologię, matematykę i, zainteresowany nią przez Philippa Apiana, astronomię.Philipp Apian, znany także jako Philipp Bennewitz lub Bienewitz (ur.","(Ostfildern:) Jan Thorbecke Verlag, 2008 (Tübinger Bausteine zur Landesgeschichte, 10), pp.==Career==Maestlin studied theology, mathematics, and astronomy/astrology at the Tübinger Stift in Tübingen, a town in Württemberg.== Life ==He was born in Ingolstadt as Philipp Bienewitz (or Bennewitz).","(ostfildern :) jan thorbecke verlag, 2008 (tübinger bausteine zur landesgeschichte, 10), 355 - 395 maestlin studied theology, mathematics at tübinger stift and, interested in it through philipp apian, astronomy philipp apian, also known as philipp bennewitz or bienewitz (born",0.334
263,"""double-strand breaks"", DSBs), w efekcie których oba łańcuchy nukleotydowe w podwójnej helisie zostają zerwane, są szczególnie niebezpieczne dla komórki, gdyż mogą prowadzić do nieodwracalnych zmian w genomie.","===Double-strand breaks===Double-strand breaks, in which both strands in the double helix are severed, are particularly hazardous to the cell because they can lead to genome rearrangements.","&quot;double-strand breaks&quot; (dsbs), as a result of which both nucleotide chains in the double helix are broken, are particularly dangerous for the cell, as they can lead to irreversible changes in the genome.",0.222
264,"W filmie debiutuje tollywoodzki aktor Mahesh Babu u boku bollywoodzkiej aktorki Preity Zinta."", który wydany został w Wielkiej Brytanii dnia 30 kwietnia 2007.",In the movie Krishna made a guest appearance as the father of Mahesh Babu.It was released in the United Kingdom on 30 April 2007 through Phonogenic Records.,"hollywood actor mahesh babu makes his film debut alongside bollywood actress preity zinta &quot;, which was released in the uk on april 30, 2007.",0.106
265,"Dolny Manhattan), Midtown (Środkowy) i Upper (Górny) z Piątą Aleją stanowiącą granicę pomiędzy częścią wschodnią (East Side) a zachodnią (West Side).","==Geography=====Description=======Manhattan Island====Manhattan is loosely divided into Downtown (Lower Manhattan), Midtown (Midtown Manhattan), and Uptown (Upper Manhattan), with Fifth Avenue dividing Manhattan's east and west sides.","lower manhattan, midtown, and upper with fifth avenue being the boundary between the east side and west side.",0.0
266,"Cała sprawa odwoławcza zakończyła się w marcu 2003 roku.Tenisowy turniej WTA Forest Hills Tennis Classic 2008 odbył się w dniach 19 – 23 sierpnia w części nowojorskiej dzielnicy Queens zwanej Forest Hills na kortach twardych.Polluks b (beta Geminorum b, β Gem b, β Geminorum b, HD 62509 b) – planeta pozasłoneczna typu gazowy olbrzym, znajdująca się w odległości około 34 lat świetlnych od Ziemi w gwiazdozbiorze Bliźniąt.","The retrial ended in March, 2003.It was the 5th edition of the Forest Hills Tennis Classic, and was part of the Tier IV Series of the 2008 WTA Tour.Pollux b, also known as Beta Geminorum b (β Gem b / β Geminorum b) and HD 62509 b, is an extrasolar planet approximately 34 light-years away in the constellation of Gemini (the Twins).","the entire appeal was closed in march 2003. the 2008 wta forest hills tennis classic was held on august 19-23 in the hard court part of queens in new york city. colluks b (beta geminorum b, β gem b, β geminorum b, hd 62509 b) is an extrasolar gas-giant planet located about 34 light-years from earth in the constellation gemini.",0.32
267,"== Bibliografia ==* Geografía Ilustrada del Paraguay, Dystrybucja Arami SRL; 2007.Piauí Esporte Clube – brazylijski klub piłkarski z siedzibą w mieście Teresina, stolicy stanu Piauí.""Trophy of the Player of the Century within the Arab Countries"").24 października 1965) – niemiecki historyk sztuki i teoretyk mediów specjalizujący się w nauce o obrazie, nowoczesności oraz sztuce mediów, a także kulturze XIX wieku i sztuce włoskiego renesansu.","==References====Bibliography==* Geografía Ilustrada del Paraguay, Distribuidora Arami SRL; 2007.Piauí Esporte Clube, commonly known as Piauí, are a Brazilian football team from Teresina.He was awarded the trophy of the ""Player of the Century within the Arab Countries"".Oliver Grau (born 24 October 1965) is a German art historian and media theoretician with a focus on image science, modernity and media art as well as culture of the 19th century and Italian art of the Renaissance.","== bibliography == * geografía ilustrada del paraguay, distribution of arami srl; 2007.piauí esporte clube - brazilian football club based in the city of teresina, the capital of the state of piauí. &quot;trophy of the player of the century within the arab countries&quot;. october 24, 1965) - german art historian and media theorist specializing in image, modernity and media art, as well as the culture of the 19th century and the art of the italian renaissance.",0.409
268,"Film zawiera również ujęcie podobne do słynnej fotografii ""Wall Street"" (1915).","""Manhatta"" includes a shot similar to Strand's famous ""Wall Street"" (1915) photograph.",the film also features a shot similar to the famous &quot;wall street&quot; (1915) photograph.,0.222
269,"Współpracownikami Jonasa w Sztokholmie byli Max Martin, Denniz Pop i Jeanette Söderholm.""B.Y.O.B.","In Stockholm, Jonas worked with producers Max Martin and Denniz Pop and vocalist Jeanette Söderholm.""B.Y.O.B.","jonas&#39; collaborators in stockholm were max martin, denniz pop and jeanette söderholm. &quot;byob",0.0
270,"; Filogeneza według Xu/Makovicky’ego/ChinneryXu Xing – pracownik Instytutu Paleontologii Kręgowców i Paleoantropologii (IVPP) w Pekinie wraz z Peterem Makovickym, pracującym niegdyś dla Amerykańskiego Muzeum Historii Naturalnej (AMNH) w Nowym Jorku, i innymi naukowcami opublikował w 2002 wyniki przeprowadzonej analizy kladystycznej.","Xu/Makovicky/Chinnery Phylogeny:Xu Xing of the Chinese Institute of Vertebrate Paleontology and Paleoanthropology (IVPP) in Beijing, along with Peter Makovicky, formerly of the American Museum of Natural History (AMNH) in New York City and others, published a cladistic analysis in the 2002 description of ""Liaoceratops"".","; phylogeny according to xu / makovicky / chinneryxu xing - an employee of the institute of vertebrate paleontology and paleoanthropology (ivpp) in beijing together with peter makovicki, who once worked for the american museum of natural history (amnh) in new york, and other scientists published the results of his analysis in 2002 cladist.",0.386
271,"Po północy 1 lipca wykonano kontrolowaną eksplozję samochodu na parkingu szpitala Royal Alexandra, gdzie jeden z zamachowców jest leczony.","=== 1 July ===On the afternoon of 1 July, police carried out a controlled explosion on a car in the car park of the Royal Alexandra Hospital, where one suspect was being treated.","after midnight on july 1, a controlled car explosion was made in the parking lot of the royal alexandra hospital, where one of the bombers is being treated.",0.257
