,Sentences_from,Sentences_to,Translated_sentences,BLEU
735,"Drury był też zapalonym kolekcjonerem owadów a jego zbiory zawierały ponad 11 000 okazów.Colin Brinded (1946 – 26 listopada 2005) - profesjonalny sędzia snookerowy.Odpowiednikiem jest polski technik.== Wstęp ==W czerwcu 1665 Anglicy pokonali Holendrów w bitwie pod Lowestoft, jednak nie potrafili tego wykorzystać.","Drury was also a prolific collector—his collection comprised over 11,000 specimens.Colin Brinded (1946 – 26 November 2005) was a snooker referee for almost thirty years.*Cohen, A.M., Brawer, F.B.In June 1665 the English had soundly defeated the Dutch in the Battle of Lowestoft, but failed to take advantage of it.","Drury was also an avid collector of insects and his collection contained over 11,000 specimens. Colin Brinded (1946 – 26 November 2005) was a professional snooker referee. The equivalent is Polish techniques.==Introduction==In June 1665, the English defeated the Dutch at the Battle of Lowestoft, but were unable to take advantage of it.",0.374
736,"Hrabstwo zostało utworzone z Portage w 1846.(21269) Bechini (1996 LG) – planetoida z grupy pasa głównego asteroid okrążająca Słońce w ciągu 3,43 lat w średniej odległości 2,27 j.a.Stolicą prowincji jest miasto Kirkuk.(21311) Servius (1996 XC9) – planetoida z pasa głównego asteroid okrążająca Słońce w ciągu 3,32 lat w średniej odległości 2,23 j.a.: Chevalier d'Eon, Pierre de Beaumarchais, Charles Théveneau de Morande i Louis de Noailles.(21523) GONG (1998 MW15) – planetoida z pasa głównego asteroid okrążająca Słońce w ciągu 5,21 lat w średniej odległości 3 j.a.Odkryta 15 sierpnia 1998 roku.Odkryta 20 sierpnia 1998 roku.Klub ma siedzibę w mieście Kashima, leżącym w Prefekturze Ibaraki.(21602) Ialmenus (1998 YW1) – planetoida z grupy trojańczyków okrążająca Słońce w ciągu 11,8 lat w średniej odległości 5,18 j.a.Odkryta 9 czerwca 1999 roku.Najbardziej popularne to Cata i Coroni.","Its county seat and largest city is Portage.21269 Bechini (1996 LG) is a main-belt asteroid discovered on June 6, 1996 by L. Tesi and A. Boattini at San Marcello Pistoiese.The provincial capital is the city of Kirkuk.21311 Servius (1996 XC9) is a main-belt asteroid discovered on December 4, 1996 by V. S. Casulli at Colleverde di Guidonia.Famous agents included the Chevalier d'Eon, Pierre de Beaumarchais, Charles Théveneau de Morande, and Louis de Noailles.21523 GONG (1998 MW15) is a main-belt asteroid discovered on June 26, 1998 by R. A. Tucker at the Goodricke-Pigott Observatory.The asteroid was discovered on August 15, 1998.The asteroid was discovered on August 20, 1998.Its hometowns are Kashima, Itako, Hasaki and Kamisu, all in Ibaraki Prefecture.21602 Ialmenus (1998 YW1) is a Jupiter Trojan discovered on December 17, 1998 by M. Tichy and Z. Moravec at Klet.The asteroid was discovered on June 9, 1999.The most popular are Cata and Choroni.","The county was formed from Portage in 1846.(21269) Bechini (1996 LG) is a main-belt asteroid that orbits the Sun for 3.43 years at an average distance of 2.27 AU.The provincial capital is the city of Kirkuk. (21311) Servius (1996 XC9) is a main-belt asteroid that orbits the Sun for 3.32 years at an average distance of 2.23 AU: Chevalier d'Eon, Pierre de Beaumarchais, Charles Théveneau de Morande and Louis de Noailles. (21523) GONG (1998 MW15) is a main-belt asteroid that orbits the Sun for 5.21 years at an average distance of 3 AU.It was discovered on August 15, 1998. Discovered on August 20, 1998. The club is based in Kashima, Ibaraki Prefecture. (21602) Ialmenus (1998 YW1) is a Trojan asteroid that orbits the Sun for 11.8 years at an average distance of 5.18 AU.Discovered on June 9, 1999. The most popular are Cata and Coroni.",0.316
737,"W 1631 Étienne sprzedał swą pozycję drugiego prezydenta ""Cour des Aides"" za sumę 65 665 liwrów.","In 1631 Étienne sold his position as second president of the ""Cour des Aides"" for 65,665 livres.","In 1631, Étienne sold his position as second president to the ""Cour des Aides"" for the sum of 65,665 livres.",0.625
738,"Sezonowo odbywają się również podróże na linii kolejowej Brunswick - Rockland obsługiwanej przez Maine Eastern Railroad, która dzierżawi linię kolejową Rockland Branch.","Seasonal passenger excursions between Brunswick and Rockland are operated by the Maine Eastern Railroad, which leases the state-owned Rockland Branch rail corridor.","There are also seasonal journeys on the Brunswick - Rockland railroad operated by the Maine Eastern Railroad, which leases the Rockland Branch railroad.",0.424
739,"Tym razem w grupie przyjaciół obecni są przyjaciółka Andreasa, Carly Simon oraz Mindy Jostyn, Carlos Núñez, Dżiwan Gasparian, XiaoJing Wang i Walter Keiser.","This time, Andreas' friend Carly Simon joins the group, as well as Mind Jostyn, Carlos Nuñez, Djivan Gasparian, XiaoJing Wang and Walter Keiser.","This time, Andreas' friend Carly Simon and Mindy Jostyn, Carlos Núñez, Jiwan Gasparian, XiaoJing Wang and Walter Keiser are present in the group of friends.",0.418
740,"Choć geograficznie odległe od siebie, Polska i Stany Zjednoczone okazały się podobne w tym, jak kształtowały systemy polityczne.","Poland and the United States, though geographically distant, displayed notable similarities in their approaches to the design of political systems.","Although geographically distant from each other, Poland and the United States turned out to be similar in how they shaped political systems.",0.219
741,"Odkrył ją w 1771 roku Charles Messier.Sennett znalazł się w gronie współzałożycieli New York Institute for Humanities.""What's Up, Doc?","It was discovered by Charles Messier in 1771.He is the founding director of the New York Institute for the Humanities.""What's Up, Doc?","It was discovered in 1771 by Charles Messier.Sennett was one of the co-founders of the New York Institute for Humanities."" What's Up, Doc?",0.313
742,"=== OST (2010) ===W 2010 roku, Yesung wystąpił w tytułowej roli w musicalu ""Hong Gil Dong"", razem z Sungminem, który grał postać historyczną.","===2010: OST===In 2010, Yesung starred in the title role of musical ""Hong Gil Dong"", alongside band mate Sungmin who also played the historical figure Hong Gildong.","===OST (2010)===In 2010, Yesung starred in the title role in the musical Hong Gil Dong, along with Sungmin, who played a historical figure.",0.368
743,"Liczba mieszkańców w 2000 roku wynosiła 208.Cabool to miasto w Stanach Zjednoczonych, w stanie Missouri.","The median age in the city was 34.3 years.Cabool is a city in Texas County, Missouri, United States.","Its population was 208 at the 2000 census.Cabool is a city in Cabool County, Missouri, United States.",0.284
744,Jego wewnętrzna granica nie jest ściśle określona ze względu na istnienie dużo jaśniejszego pierścienia głównego i halo.,Its inner boundary is not clearly defined because of the presence of the much brighter main ring and halo.,Its inner boundary is not strictly defined due to the existence of a much brighter main ring and halo.,0.467
745,"Single ""Where Is the Love?W 2002 r. grupa The Moldy Peaches rozpadła się, a Green skupił się na swojej solowej karierze.","The singles ""Where Is The Love?In 2002, the Moldy Peaches went on hiatus, and both Green and Dawson embarked on solo careers.","Singles ""Where Is the Love? In 2002, The Moldy Peaches broke up, and Green focused on his solo career.",0.239
746,"===2009===W 2009 roku, Valverde osiągnął swój największy sukces – triumfował w Vuelta a España.Herbert Lawrence Block (""Herblock"") (ur.Dotarł do ćwierćfinałów Northern Ireland Trophy 2006 oraz do finału Malta Cup 2007 gdzie przegrał z Shaunem Murphy.","On 20 September 2009, Valverde clinched the overall victory in the 2009 Vuelta a España."" Simon and Schuster, (1968)*""Straight Herblock.Day reached the quarter-finals of the 2006 Northern Ireland Trophy and was runner up in the 2007 Malta Cup, losing 4–9 to Shaun Murphy.","===2009===In 2009, Valverde achieved his greatest success in the Vuelta a España.Herbert Lawrence Block (""Herblock"") (b. He reached the quarter-finals of the 2006 Northern Ireland Trophy and the 2007 Malta Cup final where he lost to Shaun Murphy.",0.328
747,"W 1919 Leonard Woolf został redaktorem ""International Review"" i redagował dział międzynarodowy ""Contemporary Review"" (1920–1922).","In 1919 Woolf became editor of the ""International Review"", and edited the international section of the ""Contemporary Review"" (1920–22).",In 1919 Leonard Woolf became editor of the International Review and edited the international section of the Contemporary Review (1920–1922).,0.822
748,Obecnym królem jest Karol XVI Gustaw.,The current monarch is Carl XVI Gustaf.,The current king is Charles XVI Gustav.,0.0
749,"Elity nie muszą już dłużej bać się śmierci, a młodzi nie mogą liczyć na zastąpienie elit.""Differences between the mechanism of action of MDMA, MBDB, and the classic hallucinogens.Mars Express – bezzałogowa misja kosmiczna Europejskiej Agencji Kosmicznej (ESA), której celem jest badanie Marsa.","No longer do the elite fear death, and no longer can the young hope to replace them.""Differences between the mechanism of action of MDMA, MBDB, and the classic hallucinogens.Mars Express is a space exploration mission being conducted by the European Space Agency (ESA).","The elites no longer have to fear death, and the young can no longer count on being replaced by the elites."" Differences between the mechanism of action of MDMA, MBDB, and the classic hallucinogens. Mars Express is an unmanned space mission of the European Space Agency (ESA) to explore Mars.",0.358
750,"Miejscowość przecinają drogi międzystanowe 90 i 39, droga US 20 i US 51.","The village is served by Interstate 90, Interstate 39, U.S. Route 20 and U.S. Route 51.","The town is crossed by Interstates 90 and 39, US 20 and US 51.",0.0
751,"Produkcja rozpoczęła się w 1941 w fabryce znajdującej się na Badger Avenue 285 w Clinton Hill, NNewark, New Jersey.","Production began in 1941 in a factory located at 285 Badger Avenue in Clinton Hill, Newark, New Jersey.","Production began in 1941 at a factory located at 285 Badger Avenue in Clinton Hill, NNewark, New Jersey.",0.69
752,"Ale przez limit na obcokrajowców był zmuszony grać na wypożyczeniu w klubach AC Bellinzona, Górnik Zabrze i FC Chiasso.W 1950 został wysłany wraz z Janem Karolem do Hiszpanii.","After that he played on loan for Swiss AC Bellinzona, Polish Górnik Zabrze and Swiss FC Chiasso.In 1950 he and his brother Juan Carlos were sent to study in Spain.","But due to the limit on foreigners he was forced to play on loan at AC Bellinzona, Górnik Zabrze and FC Chiasso.In 1950 he was sent with Jan Karol to Spain.",0.143
753,=== Centrum miasta ===Stary Stavanger (Gamle Stavanger) znajduje się tuż obok centrum miasta i posiada kolekcję XVIII i XIX-wiecznych konstrukcji drewnianych.,===City centre===Old Stavanger (Gamle Stavanger) is located right next to the city centre and has a collection of 18th- and 19th-century wooden structures.,===City centre===Old Stavanger (Gamle Stavanger) is located right next to the city centre and has a collection of eighteenth- and nineteenth-century wooden structures.,0.808
754,"Stolicą regionu jest Tanger.Black Stone Cherry - amerykańska grupa muzyczna grająca południowego rocka, założona 4 czerwca 2001 w Edmonton.","The capital is Tangier.Black Stone Cherry is an American rock band, formed in 2001 in Edmonton, Kentucky.","The capital of the region is Tangier.Black Stone Cherry is an American Southern rock band formed on June 4, 2001 in Edmonton, Edmonton, 2001.",0.353
755,"Przedział wiekowy populacji hrabstwa kształtuje się następująco: 24,40% osób poniżej 18 roku życia, 11,90% pomiędzy 18 a 24 rokiem życia, 26,20% pomiędzy 25 a 44 rokiem życia, 21,70% pomiędzy 45 a 64 rokiem życia oraz 15,90% osób powyżej 65 roku życia.","In the county the population was spread out with 24.40% under the age of 18, 11.90% from 18 to 24, 26.20% from 25 to 44, 21.70% from 45 to 64, and 15.90% who were 65 years of age or older.","In the county the population was spread out with 24.40% under the age of 18, 11.90% from 18 to 24, 26.20% from 25 to 44, 21.70% from 45 to 64, and 15.90% who were 65 years of age or older.",1.0
756,Forty-five Pen-and-Ink Drawings by Louis Wain.,Forty-five Pen-and-Ink Drawings by Louis Wain.,Forty-five Pen-and-Ink Drawings by Louis Wain.,1.0
757,": Широки леса и поля,: Славься, Родина моя!",":Широки леса и поля,:Славься, Родина моя!",": Широки леса и поля,: Славься, Родина моя!",0.0
758,"Wiele lat po premierze ""Degrassi"" w 1990 r. Aaron Spelling wyprodukował ""Beverly Hills, 90210"".XX wieku.Tarantula - pierwszy singel zespołu Smashing Pumpkins z ich szóstej płyty Zeitgeist.","In 1990, Darren Star created ""Beverly Hills, 90210"" along with famous producer Aaron Spelling.J.-L.J.""Tarantula"" is a song by The Smashing Pumpkins.","Years after the release of ""Degrassi"" in 1990, Aaron Spelling produced ""Beverly Hills, 90210."" XX century. "" Tarantula "" is the first single from the Smashing Pumpkins' sixth album Zeitgeist.",0.0
759,"w tomografach firmy Picker PQ5000 jest 4800 detektorów).Został odkryty w 1878 r. przez Jean Charles Galissard de Marignaca.DTI – diffusion tensor imaging""), które może być zaadaptowane do obrazowania zmian w połączeniach istoty białej, oraz obrazowanie zależne od dyfuzji (""ang.Utwór brzmiał niemal jak religijna pieśń pochwalna, a jego styl muzyczny był podobny do hymnów innych europejskich monarchii.","In the U.S., the first installation was at the Mayo Clinic.==History==Ytterbium was discovered by the Swiss chemist Jean Charles Galissard de Marignac in the year 1878.The recent development of diffusion tensor imaging (DTI) enables diffusion to be measured in multiple directions and the fractional anisotropy in each direction to be calculated for each voxel.The song resembled a hymn, and its musical style was similar to that of other anthems used by European monarchs.","there are 4800 detectors in Picker PQ5000 tomographs). It was discovered in 1878 by Jean Charles Galissard de Marignac.DTI – diffusion tensor imaging""), which can be adapted to image changes in white matter connections, and diffusion-dependent imaging. The song sounded almost like a religious song of praise, and its musical style was similar to the anthems of other European monarchies.",0.159
760,"1887* 1973:** Lex Barker, amerykański aktor (zm.","1948)*1973 – Lex Barker, American actor (b.","1887*1973 – Lex Barker, American actor (d.",0.615
761,"Tekst jest pisany małą uncjałą w dwóch kolumnach na stronę, 24 linijek w kolumnie.","It is written in two columns per page, 24 lines per page, in small uncial letters.","The text is written in small uncial in two columns per page, 24 lines per page.",0.675
762,"Krkić został uhonorowany nagrodą Bronze Ball (Brązowa Piłka) dla trzeciego najlepszego zawodnika turnieju, a wyprzedzili go Macauley Chrisantus (Silver Ball) i Toni Kroos (Golden Ball).","Because of his performances, Bojan was given the Adidas Bronze Ball, naming him the third best player in the tournament, behind Macauley Chrisantus (silver) and Toni Kroos (gold).","Krkić was honored with the Bronze Ball award for the third best player of the tournament, and was overtaken by Macauley Chrisantus (Silver Ball) and Toni Kroos (Golden Ball).",0.181
763,"Drugie północno-wschodnie wyjście posiada drzwi przy Drottninggatan, Sergels torg 16 i Klarabergsgatan 48.","The second entrance (TCE N) is located to the northeast, and its doors are located at Drottninggatan, Sergels torg 16 and Klarabergsgatan 48.","The second north-eastern exit has doors at Drottninggatan, Sergels torg 16 and Klarabergsgatan 48.",0.334
764,"===Demografia===Według spisu z 2000 roku wioskę zamieszkuje 481 osób skupionych w 212 gospodarstwach domowych, tworzących 132 rodzin.","==Demographics==As of the census of 2000, there were 481 people, 212 households, and 132 families residing in the village.","==Demographics==As of the census of 2000, there were 481 people, 212 households, and 132 families residing in the village.",1.0
765,Swoją trzecią książkę Darwin ukończył w 1846.,Darwin completed his third geological book in 1846.,Darwin completed his third book in 1846.,0.5
766,"1937)* 1973:** Noël Coward, brytyjski dramaturg, kompozytor, aktor, scenarzysta filmowy (ur.","1937)*1973 – Noël Coward, English actor, director, playwright, and composer (b.","1937)*1973 – Noël Coward, English playwright, composer, actor, and screenwriter (b.",0.417
767,"Pod względem zaludnienia Tibro jest 204. gminą w Szwecji.W gminie zameldowanych jest 330 cudzoziemców.Gmina położona jest w regionie Västra Götaland, siedzibą jej władz jest Töreboda.","Its seat is located in the town of Tibro.It is located in the province of Bohuslän.Töreboda Municipality (""Töreboda kommun"") is a municipality in Västra Götaland County in western Sweden.","In terms of population, Tibro is the 204th municipality in Sweden.There are 330 foreigners registered in the municipality. The municipality is located in the Västra Götaland region, its seat is Töreboda.",0.155
768,* Kevin Keelan (1963–80)* Ian Culverhouse (1985–94)* Steve Bruce (1984–87)* Duncan Forbes (1968–81)* Mark Bowen (1987–96)* Darren Huckerby (2003–08)* Ian Crook (1986–97)* Martin Peters (1975–80)* Darren Eadie (1993–99)* Chris Sutton (1991–94)* Iwan Roberts (1997–2004)=== Gracz roku w klubie ====== Inne sekcje sportowe ===Norwich City posiada także inną sekcję – sekcję piłki nożnej kobiecej.Fulham Football Club (wymowa: /ˈfʊləm/) – angielski klub piłkarski mający siedzibę w Londynie w dzielnicy Hammersmith and Fulham założony w 1879 roku.,"* Kevin Keelan (1963–80)* Ian Culverhouse (1985–94)* Steve Bruce (1984–87)* Duncan Forbes (1968–81)* Mark Bowen (1987–96)* Darren Huckerby (2003–08)* Ian Crook (1986–97)* Martin Peters (1975–80)* Darren Eadie (1993–99)* Chris Sutton (1991–94)* Iwan Roberts (1997–2004)===Players of the Year===:""For a more detailed list of these winners of the Barry Butler trophy, see Norwich City Players of the Year.Fulham Football Club is a professional football club based in Fulham, London Borough of Hammersmith and Fulham, southwest London.","* Kevin Keelan (1963–80)* Ian Culverhouse (1985–94)* Steve Bruce (1984–87)* Duncan Forbes (1968–81)* Mark Bowen (1987–96)* Darren Huckerby (2003–08)* Ian Crook (1986–97)* Martin Peters (1975–80)* Darren Eadie (1993–99)* Chris Sutton (1991–94)* Ivan Roberts (1997–2004)=====Club Player of the Year=====Other sports sections===Norwich City also has another section, the women's football section. Fulham Football Club (pronounced /ˈfʊləm/) is an English football club based in Hammersmith and Fulham, London, founded in 1879.",0.49
769,": Arizona Science Center, Hall of Flame Firefighting Museum, Phoenix Museum of History, Pueblo Grande Museum and Cultural Park oraz Children's Museum of Phoenix.","They include the Phoenix Art Museum, Arizona Capitol Museum, Arizona Military Museum, Hall of Flame Firefighting Museum, the Pueblo Grande Museum and Cultural Park, Children's Museum of Phoenix, Arizona Science Center, and the Heard Museum.","Arizona Science Center, Hall of Flame Firefighting Museum, Phoenix Museum of History, Pueblo Grande Museum and Cultural Park, and Children's Museum of Phoenix.",0.344
770,"1929)** Elsa Lanchester, brytyjska aktorka (ur.","1895)*1986 – Elsa Lanchester, English-American actress and singer (b.","1929)** Elsa Lanchester, English actress (b.",0.0
771,"Ten projekt był dyskutowany na szczycie w Narrabri, w Nowej Południowej Walii pierwszego grudnia 2006 roku.","This project was discussed at a summit in Narrabri, NSW on 1 December 2006.","This project was discussed at a summit in Narrabri, New South Wales on the first of December 2006.",0.495
772,"* ""Die Sorben in Deutschland"", pod red.","* ""Die Sorben in Deutschland"", pod red.","* ""Die Sorben in Deutschland"", edited by ""Die Sorben in Deutschland"", edited by",0.187
773,"== Sąsiednie gminy ==Bochnia, Borzęcin, Dębno, Gnojnik, Nowy Wiśnicz, Rzezawa, SzczurowaSiedziba gminy to Brzeszcze, oprócz tego, w jej skład wchodzą: Jawiszowice, Przecieszyn, Skidziń, Wilczkowice, Zasole.== Sołectwa ==Aleksandrowo, Brzezie, Falborz, Guźlin, Jaranówek, Jądrowice, Kąkowa Wola, Kąty, Kuczyna, Machnacz, Miechowice, Miechowice Nowe, Pikutkowo, Redecz Krukowy, Rzadka Wola, Rzadka Wola-Parcele, Słone, Sokołowo, Sokołowo-Kolonia, Stary Brześć, Wieniec, Wieniec-Zalesie, Witoldowo, Wolica.== Demografia ==Dane z 30 czerwca 2004:== Miejscowości ==Brzozów, Górki, Grabownica Starzeńska, Humniska, Przysietnica, Stara Wieś, Turze Pole, Zmiennica.","==Neighbouring gminas==Gmina Brzesko is bordered by the gminas of Bochnia, Borzęcin, Dębno, Gnojnik, Nowy Wiśnicz, Rzezawa and Szczurowa.==Villages==Apart from the town of Brzeszcze, Gmina Brzeszcze contains the villages and settlements of Jawiszowice, Przecieszyn, Skidziń, Wilczkowice and Zasole.==Villages==Apart from the town of Brześć Kujawski, Gmina Brześć Kujawski contains the villages and settlements of Aleksandrowo, Brzezie, Falborek, Falborz, Falborz-Kolonia, Gustorzyn, Guźlin, Jądrowice, Jaranówek, Kąkowa Wola, Kąkowa Wola-Parcele, Kąty, Kuczyna, Machnacz, Miechowice, Miechowice Duże, Parcele Sokołowskie, Pikutkowo, Redecz Krukowy, Rzadka Wola, Rzadka Wola-Parcele, Słone, Sokołowo-Kolonia, Starobrzeska Kolonia, Stary Brześć, Wieniec, Wieniec-Zalesie, Wieniec-Zdrój, Witoldowo and Wolica.==Villages==Apart from the town of Brzozów, Gmina Brzozów contains the villages and settlements of Górki, Grabownica Starzeńska, Humniska, Stara Wieś, Turze Pole, Wola Górecka and Zmiennica.","==Neighbouring gminas==Gmina Bochnia is bordered by the gminas of Bochnia, Borzęcin, Dębno, Gnojnik, Nowy Wiśnicz, Rzezawa and SzczurowaThe gmina contains the villages and settlements of Jawiszowice, Przecieszyn, Skidziń, Wilczkowice and Zasole.==Villages==Gmina Brześć contains the villages and settlements of Aleksandrowo, Brzezie, Falborz, Guźlin, Jaranówek, Jądrowice, Kąkowa Wola, Kąty, Kuczyna, Machnacz, Miechowice Nowe, Pikutkowo, Redecz Krukowy, Rzadka Wola, Rzadka Wola-Parcele, Słone, Sokołowo, Sokołowo-Kolonia, Stary Brześć, Wieniec, Wieniec-Zalesie, Witoldowo and Woli. ==Villages==Gmina Grabownica Starzeńska is disputed as of 30 June 2004.=Villages==Gmina Grabownica Starzeńska is a gmina ( localities ) and Gmina Brzozów is a village in the villages and settlements of Brzozów, Górki, Grabownica Starzeńska, Humniska, Przysietnica, Stara Wieś, Turze Pole and Zmiennica.",0.452
774,"1930)** Maurice Sendak, amerykański pisarz (ur.","1962)* 2012 – Maurice Sendak, American author and illustrator (b.","1930)** Maurice Sendak, American author (b.",0.278
775,"Sainte Marie-du-Mont is shown in the right lower middle, next to Drop Zone C. The battery at Brécourt Manor is marked in red directly above the village.24 września 1972) - amerykański muzyk, lider zespołu Eagles of Death Metal.Mieszka w Sugar Land w Teksasie z żoną i trójką dzieci.Wastek (Huastek) – majański język używany w Meksyku przez lud Huasteków, żyjący na wiejskich terenach San Luis Potosí oraz północnego Veracruz.","Sainte Marie-du-Mont is shown in the right lower middle, next to Drop Zone C. The battery at Brécourt Manor is marked in red directly above the village.He is known as the frontman of the California-based rock band, Eagles of Death Metal.He currently lives in Sugar Land, Texas with his wife and three children.The Wasteko (Huasteco) language is a Mayan language of Mexico, spoken by the Huastecos living in rural areas of San Luis Potosí and northern Veracruz.","Sainte Marie-du-Mont is shown in the right lower middle, next to Drop Zone C. The battery at Brécourt Manor is marked in red directly above the village.He (born September 24, 1972) is an American musician and the leader of the band Eagles of Death Metal.He lives in Sugar Land, Texas with his wife and three children. Wastek (Huastek) is a Mayan language spoken in Mexico by the Huastec people, living in the rural areas of San Luis Potosí and northern Veracruz.",0.628
776,"Wiktoria zamieszkała wtedy w swoim własnym domu w Coppins, Iver, Buckinghamshire.","The Princess then set up her own home at Coppins, Iver, in Buckinghamshire.","Victoria then lived in her own home in Coppins, Iver, Buckinghamshire.",0.0
