,Sentences_from,Sentences_to,Translated_sentences,BLEU
229,"Następnie Raquel poznała Juana Luisa Suáreza i razem z Davidem Feito założyli zaspół ""El Sueño de Morfeo"".W latach 1777 - 1873 był podstawową walutą Szwecji.","Soon after Raquel and David met Juan Luis Suárez, and the three created ""El Sueño de Morfeo"".Between 1777 and 1873, it was the currency of Sweden.","Raquel then met Juan Luis Suárez and together with David Feito founded the company ""El Sueño de Morfeo"". Between 1777 and 1873 it was the main currency of Sweden.",0.379
230,"W roku 2005 po wygraniu trzeciej ligi klub awansował do drugiej ligi Campeonato Brasileiro.12 listopada 1981 w Rotenburg an der Fulda) – niemiecka lekkoatletka, specjalizująca się w skoku o tyczce.","In 2005, the club was promoted to the second division after winning the third division.Annika Becker (born 12 November 1981 in Rotenburg an der Fulda) is a retired German pole vaulter.","In 2005, after winning the third division, the club was promoted to the second division of the Campeonato Brasileiro.Süd (born 12 November 1981 in Rotenburg an der Fulda) is a German pole vaulter.",0.638
231,W 1998 roku Psychosis dołączył do założonej przez Eddiego Guerrero grupy - Latino World Order (LWO).,"In 1998, Psychosis joined Eddy Guerrero's Latino World Order (LWO) group, which consisted entirely of Mexican wrestler.","In 1998, Psychosis joined Eddie Guerrero's Latino World Order (LWO).",0.359
232,"Pisarz ""Hollywood Reporter Sophie Schillaci"" stwierdził, że ""ma głos, który może uciszyć nawet najsurowszych krytyków.== Biografia ==Urodził się w Empoli w Toskanii jako Dante Michelangelo Benvenuto Ferruccio Busoni, jako jedyne dziecko rodziców-muzyków.","""The Hollywood Reporter"" writer Sophie Schillaci stated she ""has a voice that can silence even the harshest of critics.==Biography==Ferruccio Busoni was born in the Tuscan town of Empoli, Italy, the only child of two professional musicians.","Hollywood Reporter writer Sophie Schillaci stated that he ""has a voice that can silence even the harshest critics.==Biography==He was born Dante Michelangelo Benvenuto Ferruccio Busoni in Empoli, Tuscany, the only child of musical parents.",0.44
233,"1620)* 1721 – Rudolf Jakob Camerarius, niemiecki lekarz, botanik (ur.","1596)*1721 – Rudolf Jakob Camerarius, German botanist and physician (b.","1620)*1721 – Rudolf Jakob Camerarius, German physician and botanist (b.",0.455
234,Berlinghieri przedstawił na nim Chrystusa w sposób typowy dla sztuki bizantyjskiej – Christus triumphans.Dostępny jest niebiesko znakowanym szlakiem turystycznym z miejscowości Kuchyňa lub ze schroniska turystycznego Zochova chata.,"He was the father of the painters Barone Berlinghieri, Bonaventura Berlinghieri, and Marco Berlinghieri.==Approach==Usual points of departure for a one day trip are Zochova chata and Kuchyňa.",Berlinghieri depicted Christ in a manner typical of Byzantine art – Christus triumphans. It is accessible by a blue marked hiking trail from Kuchyňa or from the tourist hostel Zochova chata.,0.0
235,Wkrótce w Londynie zjawił się Jay Sebring nalegając na spotkanie z Polańskim.,Jay Sebring traveled to London where he insisted on meeting Polanski.,"Soon Jay Sebring arrived in London, insisting on a meeting with Polanski.",0.0
236,"W czasach Kassandra Pella została rozbudowana według planu hippodamejskiego.Orkiestrami Maggio Musicale Fiorentino i Teatro dell'Opera di Roma dyrygował Zubin Mehta.""Bánffyhunyad"") – miasto w zachodniej Rumunii, w okręgu Kluż.Burnt Offerings – trzeci album zespołu Iced Earth.Młode małżeństwo zamieszkało w pałacu Noordeinde w Hadze.","On the site of the ancient city of Pella is the Archaeological Museum of Pella.Zubin Mehta conducted the orchestra of Maggio Musicale Fiorentino and the orchestra of Teatro dell'Opera di Roma.Huedin (, ; ; ) is a town in Cluj County, Romania.Burnt Offerings is the third studio album by American heavy metal band Iced Earth.The young couple went to live at Noordeinde Palace in The Hague.","At the time of Kassandra Pell, it was expanded according to the Hippodamean plan. The orchestras of the Maggio Musicale Fiorentino and the Teatro dell'Opera di Roma were conducted by Zubin Mehta."" Bánffyhunyad is a town in Cluj County, Romania.Burnt Offerings is the third studio album by Iced Earth.The young couple lived in Noordeinde Palace in The Hague.",0.408
237,"W 1908 roku zaprezentował całość swoich prac przed ""Royal College of Physicians"" w wykładzie zatytułowanym ""Inborn Errors of Metabolism"" (""Wrodzone wady metabolizmu""), który został opublikowany w roku 1909.","In 1908, the core of this work was presented as the Croonian Lectures to the Royal College of Physicians, entitled Inborn Errors of Metabolism and published the following year.","In 1908 he presented all his work to the Royal College of Physicians in a lecture entitled ""Inborn Errors of Metabolism"", which was published in 1909.",0.32
238,"Charles I and the Scottish Troubles, 1637–1641"", 1990.","Charles I and the Scottish Troubles, 1637–1641"", 1990.","Charles I and the Scottish Troubles, 1637–1641"", 1990.",1.0
239,"Zdjęcia zrealizowano w warszawskim klubie Proxima 15 czerwca 2001 roku.: מועדון הכדורגל מכבי חיפה, ""Moadon HaKaduregel Maccabi Haifa"") jest izraelskim klubem piłkarskim z Hajfy.Odbudowa została oficjalnie zakończona w 2001.Leo Strauss (ur.Tour Generación 2006Tour Generación 2006 to druga trasa koncertowa zespołu RBD.","It was filmed at Proxima Club in Warsaw, Poland, on June 15, 2001.Maccabi Haifa Football Club (, ""Moadon HaKaduregel Maccabi Haifa"") is an Israeli professional football club, based in Kiryat Eliezer, City of Haifa, a section of Maccabi Haifa sports club.It was officially completed in 2001.J. Harvey Lomax.;""RBD Tour Brasil 2006""RBD did a stadium tour through Brazil.","Filming took place at proxima in Warsaw on June 15, 2001.מועדון הכדורגל מכבי חיפה, ""Moadon HaKaduregel Maccabi Haifa"") is an Israeli football club from Haifa.The reconstruction was officially completed in 2001.Leo Strauss (b. Tour Generación 2006Tour Generación 2006 is the second concert tour of the band RBD.",0.196
240,"23 kwietnia 1983 roku Laibach zadebiutował w telewizji w programie informacyjno-publicystycznym TV Tednik, co wywołało negatywne reakcje władz – zabroniono występowania członkom grupy na koncertach i używania niemieckiej nazwy Laibach.","The subsequent debut television appearance on June 23, 1983, in the informative-political program ""TV Tednik"", caused major negative reactions after which they were banned from using the name Laibach as well as performing in public.","On April 23, 1983, Laibach made his television debut on the news and current affairs program TV Tednik, which provoked negative reactions from the authorities – it was forbidden for members of the group to perform at concerts and to use the German name Laibach.",0.0
241,"== Geografia ==Według spisu hrabstwo zajmuje powierzchnię 730 km², z czego 728 km² stanowią lądy, a 2 km² (0,24%) stanowią wody.","==Geography==According to the U.S. Census Bureau, the county has a total area of , of which is land and (0.5%) is water.","==Geography==According to the census, the county covers an area of 730 km², of which 728 km² is land and 2 km² (0.24%) is water.",0.0
242,W kwietniu 2009 EMC2 uzyskało kolejne 2 miliony USD w ramach ustawy American Recovery and Reinvestment Act 2009.,"In April 2009, the DoD published a plan to provide Polywell a further $2 million in funding as part of the American Recovery and Reinvestment Act of 2009.","In April 2009, EMC2 received another $2 million under the American Recovery and Reinvestment Act of 2009.",0.31
243,"Ascella znajduje się 90 ly od Ziemi.Jej siedziba mieści się w Londynie, posiada także biuro w Los Angeles.The Firm - angielska supergrupa rockowa, której skład tworzyli były wokalista zespołów Free i Bad Company - Paul Rodgers, były gitarzysta Led Zeppelin – Jimmy Page, basista Tony Franklin, oraz były perkusista zespołu Uriah Heep – Chris Slade.","It has the traditional name Ascella.The company also has other offices located in Los Angeles and Ireland.The Firm were a British rock supergroup comprising former Free and Bad Company singer Paul Rodgers, guitarist Jimmy Page formerly of The Yardbirds and Led Zeppelin, and Manfred Mann's Earth Band and Uriah Heep drummer Chris Slade and bass player Tony Franklin.","Ascella is located 90 ly from Earth.It is headquartered in London and has an office in Los Angeles.The Firm is an English rock supergroup consisting of former Free and Bad Company vocalist Paul Rodgers, former Led Zeppelin guitarist Jimmy Page, bassist Tony Franklin, and former Uriah Heep drummer Chris Slade.",0.186
244,"* ""Trois réformateurs : Luther, Descartes, Rousseau, avec six portraits"", Paris, Plon, 1925* ""Réponse à Jean Cocteau"", 1926* ""Une opinion sur Charles Maurras et le devoir des catholiques"", Paris, Plon, 1926* ""Primauté du spirituel"", 1927* ""Pourquoi Rome a parlé"" (coll.","* ""Trois réformateurs : Luther, Descartes, Rousseau, avec six portraits"", Paris , 1925* ""Réponse à Jean Cocteau"", 1926* ""Une opinion sur Charles Maurras et le devoir des catholiques"", Paris , 1926* ""Primauté du spirituel"", 1927* ""Pourquoi Rome a parlé"" (coll.","* ""Trois réformateurs : Luther, Descartes, Rousseau, avec six portraits"", Paris, Plon, 1925* ""Réponse à Jean Cocteau"", 1926* ""Une opinion sur Charles Maurras et le devoir des catholiques"", Paris, Plon, 1926* ""Primauté du spirituel"", 1927* ""Pourquoi Rome a parlé"" (coll.",0.859
245,"Woodbury, N.Y.: Barron’s Educational Series, 1979.","Wo odbury, N.Y.: Barron's Educational Series, 1979.","Woodbury, N.Y.: Barron's Educational Series, 1979.",0.615
246,Nazwa Łabiszyn pochodzi prawdopodobnie od księcia Łabiszy.,The name Łabiszyn originates probably from the prince Łabiszy.,The name Łabiszyn probably comes from prince Łabiszy.,0.0
247,"Str.W 1504 odziedziczył tytuł księcia de Guise.Jagienna – część wsi Domaradz w Polsce położona w województwie opolskim, w powiecie namysłowskim, w gminie Pokój.Żabiniec – część wsi Domaradz w Polsce położony w województwie opolskim, w powiecie namysłowskim, w gminie Pokój.W lecie 1996 roku, w czasie okienka transferowego, przeszedł na zasadzie wolnego transferu do AS Monaco.""Claude de Lorraine"" (20 października 1496, w Condé-sur-Moselle - 12 kwietnia 1550, w Joinville) - pierwszy książę de Guise w latach 1528-1550.","Pg.He succeeded as Count of Guise in 1504.Jagienna is a village in the administrative district of Gmina Pokój, within Namysłów County, Opole Voivodeship, in south-western Poland.Żabiniec is a village in the administrative district of Gmina Pokój, within Namysłów County, Opole Voivodeship, in south-western Poland.Collins moved to AS Monaco in the summer of 1996 on a free transfer under the Bosman ruling.Claude de Lorraine, duc de Guise (20 October 1496, Château de Condé-sur-Moselle, – 12 April 1550, Château de Joinville) was a French aristocrat and general.","Str.In 1504 he inherited the title of Duke of Guise.Jagienna is a village in the gmina of Pokój, within Namysłów County, Opole Voivodeship, in south-opole Voivodeship, in south-central Poland.Żabiniec is a village in the gmina of Pokój, within Namysłów County, Opole Voivodeship, in south-opole Voivodeship, in south-central Poland.In the summer of 1996, during the transfer window, he moved on a free transfer to AS Monaco."" Claude de Lorraine (20 October 1496, Condé-sur-Moselle – 12 April 1550, Joinville) was the first Duke of Guise from 1528 to 1550.",0.368
248,"James Strachey, 1933)* ""Spectatorial Essays"" (ed.","James Strachey (1933)* ""Spectatorial Essays"", ed.","James Strachey, 1933)* ""Spectatorial Essays"" (ed.",1.0
249,"Z opactwa Woburn napisała do Henryka list załączając skrwawioną szatę zabitego w bitwie, króla Szkocji Jakuba IV, którą Henryk użył jako sztandaru podczas oblężenia Tournai.W 1963 roku ponownie wyjechała do Anglii, gdzie podjęła pracę bibliotekarki w londyńskim ""Foreign and Commonwealth Office"".Wcześniej, w 1971 roku poddała się aborcji.","From Woburn Abbey she sent a letter to Henry along with a piece of the bloodied coat of King James IV of Scotland, who died in the battle, for Henry to use as a banner at the siege of Tournai.In 1963, Adcock returned to England and took up a post as an assistant librarian at the Foreign and Commonwealth Office in London until 1979.They don't see the emotions, the downs...","From Woburn Abbey, she wrote a letter to Henry attaching the bloodied robe of King James IV of Scotland, who had been killed in battle, which Henry used as a banner during the siege of Tournai.In 1963, she again went to England, where she took a job as a librarian at London's Foreign and Commonwealth Office. Earlier, in 1971, she had an abortion.",0.28
250,W tym samym roku pojawił się model Prinz 1000 i pochodne takie jak TT i TT/S.,In the same year Prinz 1000 and derivatives like the TT and TT/S followed.,"In the same year, the Prinz 1000 model and derivatives such as TT and TT/S appeared.",0.277
251,== Książki autorstwa Davida Irvinga ==* The Destruction of Dresden (1963)* The Mare’s Nest (1964)* The Virus House (1967)* The Destruction of Convoy PQ17* Accident - The Death of General Sikorski (1967)* Breach of Security (1968)* The Rise and Fall of the Luftwaffe (1973)* Hitler’s War (1977)* The Trail of the Fox (1977)* The War Path (1978)* The War Between the Generals (1981)* Uprising!Hamann był też muzykiem (grał na lutni).W 1948 została członkiem St Anne's College w Oksfordzie.,"==Bibliography=====Books===* ""The Destruction of Dresden"" (1963) ISBN 0-7057-0030-5* ""The Mare's Nest"" (1964)* ""The Virus House"" (1967)* ""The Destruction of Convoy PQ17"" (1967)* ""Accident – The Death of General Sikorski"" (1967) ISBN 0-7183-0420-9* ""Breach of Security"" (1968) ISBN 0-7183-0101-3* ""The Rise and Fall of the Luftwaffe"" (1973), a biography of Erhard Milch ISBN 0-316-43238-5* ""Hitler's War"" (1977)* ""The Trail of the Fox"" (1977), a biography of Erwin Rommel ISBN 0-525-22200-6* ""The War Path"" (1978) ISBN 0-670-74971-0* ""The War Between the Generals"" (1981)* ""Uprising!==Influences on Hamann==Hamann was greatly influenced by David Hume.In 1948, she became a fellow of St Anne's College, Oxford.","==Books by David Irving==* The Destruction of Dresden (1963)* The Mare's Nest (1964)* The Virus House (1967)* The Destruction of Convoy PQ17* Accident - The Death of General Sikorski (1967)* Breach of Security (1968)* The Rise and Fall of the Luftwaffe (1973)* Hitler's War (1977)* The Trail of the Fox (1977)* The War Path (1978)* The War Between the Generals (1981)* Uprising! Hamann was also a musician (he played the lute). In 1948 she became a Fellow of St Anne's College, Oxford.",0.525
252,""" (razem z W. G. Lohrmannem i innymi), J.",""" (with W. G. Lohrmann and others), J.",""" (with W. G. Lohrmann and others), J.",1.0
253,Transactions of the Geological Society of South Africa.,Transactions of the Geological Society of South Africa.,Transactions of the Geological Society of South Africa.,1.0
254,Zaaresztowano go ponownie w 1959 i skazano na 25 lat.,He was arrested again in 1959 and sentenced to 25 years.,He was arrested again in 1959 and sentenced to 25 years.,1.0
255,") – król Amalekitów.* Sweet Emotion zostało nagrane przez Leo Kottke i Mike'a Gordona, oraz grupy The Answer, Warrant i Ratt.","xiii.).""Sweet Emotion"" has been covered by Leo Kottke and Mike Gordon, The Answer, Warrant and Ratt.",") is the king of the Amalekites.* Sweet Emotion was recorded by Leo Kottke and Mike Gordon, as well as The Answer, Warrant and Ratt.",0.329
256,"Matthews, który dorastał w Hanley , był praktykantem w klubie, po raz pierwszy wystąpił marca 1932 r., w meczu przeciwko Bury, w wieku 17 lat.","Matthews, who grew up in Hanley, was an apprentice at the club and made his first appearance in March 1932, against Bury, at the age of 17.","Matthews, who grew up in Hanley, was an apprentice at the club, first appearing in March 1932, in a match against Bury, at the age of 17.",0.682
257,"CAD, Geospatial, GeoVRML, Humanoid animation, NURBS itp.","CAD, Geospatial, Humanoid animation, NURBS etc.","CAD, Geospatial, GeoVRML, Humanoid animation, NURBS, etc.",0.512
258,"W spisanych 50 lat później pamiętnikach Barney napisała: ""Ona nie mogła być uratowana.","In a memoir written fifty years later Barney said ""She could not be saved.","In her memoirs, written 50 years later, Barney wrote: ""She could not have been saved.",0.0
259,"Przedział wiekowy populacji hrabstwa kształtuje się następująco: 30,20% osób poniżej 18 roku życia, 7,10% pomiędzy 18 a 24 rokiem życia, 33,50% pomiędzy 25 a 44 rokiem życia, 21,30% pomiędzy 45 a 64 rokiem życia oraz 8,00% osób powyżej 65 roku życia.","In the county the population was spread out with 30.20% under the age of 18, 7.10% from 18 to 24, 33.50% from 25 to 44, 21.30% from 45 to 64, and 8.00% who were 65 years of age or older.","In the county the population was spread out with 30.20% under the age of 18, 7.10% from 18 to 24, 33.50% from 25 to 44, 21.30% from 45 to 64, and 8.00% who were 65 years of age or older.",1.0
260,"Pomimo ostrej zawodowej rywalizacji Cope również przypisał gatunek rodzajowi ""Coelurus""; w 1887 nazwał późnotriasowe szczątki z Nowego Meksyku ""C. bauri"" i ""C. longicollis"".","Despite their professional animosity, Cope also assigned species to ""Coelurus""; in 1887, he named fossils from the Late Triassic of New Mexico as ""C. bauri"" and ""C. longicollis"".","Despite fierce professional rivalry, Cope also attributed the species to the genus ""Coelurus""; in 1887 he named the Late Triassic remains from New Mexico ""C. bauri"" and ""C. longicollis"".",0.345
261,Ogromny pożar w roku 1547 zniszczył ponad 70 domów.,A major fire in 1547 destroyed more than 70 houses.,A huge fire in 1547 destroyed more than 70 houses.,0.783
262,"(Ostfildern:) Jan Thorbecke Verlag, 2008 (Tübinger Bausteine zur Landesgeschichte, 10), 355 – 395.Maestlin studiował w Tübinger Stift teologię, matematykę i, zainteresowany nią przez Philippa Apiana, astronomię.Philipp Apian, znany także jako Philipp Bennewitz lub Bienewitz (ur.","(Ostfildern:) Jan Thorbecke Verlag, 2008 (Tübinger Bausteine zur Landesgeschichte, 10), pp.==Career==Maestlin studied theology, mathematics, and astronomy/astrology at the Tübinger Stift in Tübingen, a town in Württemberg.== Life ==He was born in Ingolstadt as Philipp Bienewitz (or Bennewitz).","(Ostfildern:) Jan Thorbecke Verlag, 2008 (Tübinger Bausteine zur Landesgeschichte, 10), 355 – 395.Maestlin studied theology, mathematics and astronomy at the Tübinger Stift, interested in it by Philipp Apian. Philipp Apian, also known as Philipp Bennewitz or Bienewitz (b.",0.391
263,"""double-strand breaks"", DSBs), w efekcie których oba łańcuchy nukleotydowe w podwójnej helisie zostają zerwane, są szczególnie niebezpieczne dla komórki, gdyż mogą prowadzić do nieodwracalnych zmian w genomie.","===Double-strand breaks===Double-strand breaks, in which both strands in the double helix are severed, are particularly hazardous to the cell because they can lead to genome rearrangements.","""double-strand breaks"" (DSBs), as a result of which both nucleotide chains in the double helix are broken, are particularly dangerous for the cell, as they can lead to irreversible changes in the genome.",0.228
264,"W filmie debiutuje tollywoodzki aktor Mahesh Babu u boku bollywoodzkiej aktorki Preity Zinta."", który wydany został w Wielkiej Brytanii dnia 30 kwietnia 2007.",In the movie Krishna made a guest appearance as the father of Mahesh Babu.It was released in the United Kingdom on 30 April 2007 through Phonogenic Records.,"Tollywood actor Mahesh Babu makes his film debut alongside Bollywood actress Preity Zinta,"" which was released in the UK on 30 April 2007.",0.179
265,"Dolny Manhattan), Midtown (Środkowy) i Upper (Górny) z Piątą Aleją stanowiącą granicę pomiędzy częścią wschodnią (East Side) a zachodnią (West Side).","==Geography=====Description=======Manhattan Island====Manhattan is loosely divided into Downtown (Lower Manhattan), Midtown (Midtown Manhattan), and Uptown (Upper Manhattan), with Fifth Avenue dividing Manhattan's east and west sides.","Lower Manhattan, Midtown and Upper with Fifth Avenue forming the boundary between the East Side and the West Side.",0.0
266,"Cała sprawa odwoławcza zakończyła się w marcu 2003 roku.Tenisowy turniej WTA Forest Hills Tennis Classic 2008 odbył się w dniach 19 – 23 sierpnia w części nowojorskiej dzielnicy Queens zwanej Forest Hills na kortach twardych.Polluks b (beta Geminorum b, β Gem b, β Geminorum b, HD 62509 b) – planeta pozasłoneczna typu gazowy olbrzym, znajdująca się w odległości około 34 lat świetlnych od Ziemi w gwiazdozbiorze Bliźniąt.","The retrial ended in March, 2003.It was the 5th edition of the Forest Hills Tennis Classic, and was part of the Tier IV Series of the 2008 WTA Tour.Pollux b, also known as Beta Geminorum b (β Gem b / β Geminorum b) and HD 62509 b, is an extrasolar planet approximately 34 light-years away in the constellation of Gemini (the Twins).","The entire appeal case ended in March 2003. The 2008 WTA Forest Hills Tennis Classic was held August 19–23 in the Hard Courts portion of Queens, New York. Pollux b (beta Geminorum b, β Gem b, β Geminorum b, HD 62509 b) is an extramolastic planet of the gas giant type, located about 34 light-years from Earth in the constellation Gemini.",0.312
267,"== Bibliografia ==* Geografía Ilustrada del Paraguay, Dystrybucja Arami SRL; 2007.Piauí Esporte Clube – brazylijski klub piłkarski z siedzibą w mieście Teresina, stolicy stanu Piauí.""Trophy of the Player of the Century within the Arab Countries"").24 października 1965) – niemiecki historyk sztuki i teoretyk mediów specjalizujący się w nauce o obrazie, nowoczesności oraz sztuce mediów, a także kulturze XIX wieku i sztuce włoskiego renesansu.","==References====Bibliography==* Geografía Ilustrada del Paraguay, Distribuidora Arami SRL; 2007.Piauí Esporte Clube, commonly known as Piauí, are a Brazilian football team from Teresina.He was awarded the trophy of the ""Player of the Century within the Arab Countries"".Oliver Grau (born 24 October 1965) is a German art historian and media theoretician with a focus on image science, modernity and media art as well as culture of the 19th century and Italian art of the Renaissance.","==References==* Geography Ilustrada del Paraguay, Distribution Arami SRL; 2007.Piauí Esporte Clube is a Brazilian football club based in Teresina, Piauí. Trophy of the Player of the Century within the Arab Countries(24 October 1965) is a German art historian and media theorist specializing in the study of image, modernity and media art, as well as nineteenth-century culture and the art of the Italian Renaissance.",0.418
268,"Film zawiera również ujęcie podobne do słynnej fotografii ""Wall Street"" (1915).","""Manhatta"" includes a shot similar to Strand's famous ""Wall Street"" (1915) photograph.","The film also contains a shot similar to the famous photograph ""Wall Street"" (1915).",0.276
269,"Współpracownikami Jonasa w Sztokholmie byli Max Martin, Denniz Pop i Jeanette Söderholm.""B.Y.O.B.","In Stockholm, Jonas worked with producers Max Martin and Denniz Pop and vocalist Jeanette Söderholm.""B.Y.O.B.","Jonas' collaborators in Stockholm were Max Martin, Denniz Pop and Jeanette Söderholm."" B.Y.O.B.",0.0
270,"; Filogeneza według Xu/Makovicky’ego/ChinneryXu Xing – pracownik Instytutu Paleontologii Kręgowców i Paleoantropologii (IVPP) w Pekinie wraz z Peterem Makovickym, pracującym niegdyś dla Amerykańskiego Muzeum Historii Naturalnej (AMNH) w Nowym Jorku, i innymi naukowcami opublikował w 2002 wyniki przeprowadzonej analizy kladystycznej.","Xu/Makovicky/Chinnery Phylogeny:Xu Xing of the Chinese Institute of Vertebrate Paleontology and Paleoanthropology (IVPP) in Beijing, along with Peter Makovicky, formerly of the American Museum of Natural History (AMNH) in New York City and others, published a cladistic analysis in the 2002 description of ""Liaoceratops"".","; Phylogeny according to Xu/Makovicky/ChinneryXu Xing – an employee of the Institute of Vertebrate Paleontology and Paleoanthropology (IVPP) in Beijing together with Peter Makovicky, who once worked for the American Museum of Natural History (AMNH) in New York, and other scientists published the results of the cladistic analysis in 2002.",0.425
271,"Po północy 1 lipca wykonano kontrolowaną eksplozję samochodu na parkingu szpitala Royal Alexandra, gdzie jeden z zamachowców jest leczony.","=== 1 July ===On the afternoon of 1 July, police carried out a controlled explosion on a car in the car park of the Royal Alexandra Hospital, where one suspect was being treated.","After midnight on July 1, a controlled car explosion was carried out in the parking lot of the Royal Alexandra Hospital, where one of the attackers is being treated.",0.27
272,"Jest to spowodowane tym, że pobierają ciepło z gruntu lub wód podziemnych, które mają względnie stałą temperaturę przez cały rok poniżej głębokości około 9 metrów.",This is because they draw heat from the ground or groundwater which is at a relatively constant temperature all year round below a depth of about 30 feet (9 m).,"This is because they take heat from the ground or groundwater, which have a relatively constant temperature throughout the year below a depth of about 9 meters.",0.476
