,Sentences_from,Sentences_to,Translated_sentences,BLEU
0,"* 4 grudnia – prezydent USA Woodrow Wilson wyruszył w podróż morską do Europy na Paryską Konferencję Pokojową, była to pierwsza podróż urzędującego prezydenta Stanów Zjednoczonych do Europy.","* December 4 – President Woodrow Wilson departs by ship to the Paris Peace Conference, becoming the first United States President to travel to any foreign country while holding office.","* December 4 – U.S. President Woodrow Wilson embarks on a sea voyage to Europe for the Paris Peace Conference, the first trip by a sitting U.S. president to Europe.",0.178
1,"1937)** Dody Goodman, amerykańska aktorka (ur.","1937)* 2008 – Dody Goodman, American actress (b.","1937)** Dody Goodman, American actress (b.",0.541
2,"Uwieńczeniem współpracy Melvins z Jello Biafrą, wokalistą grupy Dead Kennedys, było wydanie dwóch albumów ""Never Breathe What You Can't See"" (2004) oraz ""Sieg Howdy!W dniu 3 lipca 2008 roku Harmon zmarł w swoim domu w Los Angeles na niewydolność serca.Do najważniejszych prac Sedgwick należą ""Between Men: English Literature and Male Homosocial Desire"" (1985) oraz ""Epistemology of the Closet"" (1990).Finally We Are No One – drugi studyjny album islandzkiej grupy múm.","===Mid 2000s – present===In 2004 Melvins collaborated with ambient artist Lustmord for ""Pigs of the Roman Empire"" and with Dead Kennedys singer Jello Biafra for ""Never Breathe What You Can't See"" and ""Sieg Howdy!==Death ==On July 3, 2008 Harmon died in his home of congestive heart failure in Los Angeles, California.===""Between Men: English Literature and Male Homosocial Desire"" (1985)===Sedgwick summed up her basic argument in ""Between Men"" in ""Epistemology of the Closet"", a later work.Finally We Are No One is an album by the Icelandic group múm.","The culmination of Melvins' collaboration with Jello Biafra, lead singer of the Dead Kennedys, was the release of two albums, ""Never Breathe What You Can't See"" (2004) and ""Sieg Howdy! On July 3, 2008, Harmon died at his home in Los Angeles of heart failure. Sedgwick's most important works include ""Between Men: English Literature and Male Homosocial Desire"" (1985) and ""Epistemology of the Closet"" (1990). Finally We Are No One is the second studio album by Icelandic heavy music band múm.",0.303
3,"W roku 1967 wygrali pięć z sześciu wyścigów, a w roku 1968 cztery z sześciu.","In 1967 they won five of six races and in 1968, four of six.",In 1967 they won five of the six races and in 1968 four out of six.,0.646
4,"W 1931 założony nowy Bist Sport, który 2 lata później zmienił nazwę na Sportkring Westerlo.",The club Bist Sport was created in 1931 and it changed its name to Sportkring Westerlo two years later.,"In 1931, a new Bist Sport was founded, which 2 years later changed its name to Sportkring Westerlo.",0.371
5,"Od roku 1999 praca jest własnością ""Dia Art Foundation"" z Nowego Jorku.27 kwietnia 1950 w Jamshedpur w Indiach) – niemiecki pianista.""The Sketch Book of Geoffrey Crayon, Gent.Jest także prezenterem telewizyjnym i autorem nagradzanych książek na temat biologii - szczególnie ewolucyjnej.","The Dia Art Foundation is currently seeking a new lease from the state.Christian Zacharias (born 1950 in Jamshedpur) is a German pianist and conductor.""The Sketch Book of Geoffrey Crayon, Gent.He is also a television presenter and a prize-winning author on the subject of biology, especially evolution.","Since 1999, the work has been owned by the Dia Art Foundation of New York City.He was born on April 27, 1950 in Jamshedpur, India. The Sketch Book of Geoffrey Crayon, Gent.He is also a television presenter and author of award-winning books on biology - especially evolutionary biology.",0.347
6,Jednakże bez względu na dokładną liczbę gatunków storczykowatych – jest ich dwa razy więcej od liczby gatunków ptaków oraz cztery razy więcej od liczby gatunków ssaków.,"Regardless, the number of orchid species nearly equals the number of bony fishes and more than twice the number of bird species, and about four times the number of mammal species.","However, regardless of the exact number of orchid species, there are twice as many as the number of bird species and four times as many as the number of mammal species.",0.374
7,"== Sąsiednie gminy ==Grodzisk Wielkopolski, Kuślin, Lwówek, Miedzichowo, Opalenica, Siedlec, Zbąszyń== Linki zewnętrzne ==== Demografia ==Dane z 30 czerwca 2004:== Struktury wyznaniowe ==== Sołectwa ==Chronów, Kobyle, Kopaliny, Królówka, Leksandrowa, Łomna, Muchówka, Olchawa, Połom Duży, Stary Wiśnicz, Wiśnicz Mały.","==Neighbouring gminas==Gmina Nowy Tomyśl is bordered by the gminas of Grodzisk Wielkopolski, Kuślin, Lwówek, Miedzichowo, Opalenica, Rakoniewice, Siedlec and Zbąszyń.==Villages==Apart from the town of Nowy Wiśnicz, Gmina Nowy Wiśnicz contains the villages and settlements of Chronów, Kobyle, Kopaliny, Królówka, Leksandrowa, Łomna, Muchówka, Olchawa, Połom Duży, Stary Wiśnicz and Wiśnicz Mały.","==Neighbouring gminas==Gmina Grodzisk Wielkopolski is bordered by the gminas of Grodzisk Wielkopolski, Kuślin, Lwówek, Miedzichowo, Opalenica, Siedlec and Zbąszyń.==References=====Gmina Chronów contains the villages and settlements of Chronów, Kobyle, Kopaliny, Królówka, Leksandrowa, Łomna, Muchówka, Olchawa, Połom Duży, Stary Wiśnicz and Wiśnicz Mały.",0.645
8,"Przedstawił się jako Frank Howard, farmer z Farmingdale w stanie Nowy Jork.","He introduced himself as Frank Howard, a farmer from Farmingdale, New York.","He introduced himself as Frank Howard, a farmer from Farmingdale, New York.",1.0
9,"1945)* 20 sierpnia - Fred Hoyle, angielski astronom, matematyk (ur.","1912)* August 20 – Fred Hoyle, British astronomer and writer (b.","1945)* August 20 – Fred Hoyle, English astronomer and mathematician (b.",0.417
10,"W trakcie sezonu Anthony zaliczył pięć rzutów które w ostatnich 5 sekundach meczu dawały jego drużynie zwycięstwo, w Houston w dniu 8 stycznia 2006 r., u siebie w meczu z Phoenix Suns 10 stycznia, z Minnesotą 24 lutego, z Indiana Pacers 15 marca oraz z Los Angeles Lakers 6 kwietnia.","During the season, Anthony made five game-winning shots in the last five seconds: at Houston on January 8, 2006; at home versus Phoenix on January 10; at Minnesota on February 24; at Indiana on March 15; at home versus the Los Angeles Lakers on April 6.","During the season, Anthony made five shots that gave his team a victory in the last 5 seconds of the game, in Houston on January 8, 2006, at home against the Phoenix Suns on January 10, against Minnesota on February 24, against the Indiana Pacers on March 15, and against the Los Angeles Lakers on April 6.",0.383
11,"""Warszawa 1930""=== Utwory nieukończone ===* Czantoria (i inne pisma społeczne).","""Warszawa 1930""===Unfinished===* Czantoria (i inne pisma społeczne).","""Warszawa 1930""=== Utwory nieukończone ===* Czantoria (i inne pisma społeczne).",0.484
12,Trzecia grupa włączyła się w aktywną opozycję.,A third group joined the active opposition.,The third group joined the active opposition.,0.809
13,"""The Kaiser's Secret Negotiations with the Tsar, 1904-1905"".","""The Kaiser's Secret Negotiations with the Tsar, 1904-1905"".","""The Kaiser's Secret Negotiations with the Tsar, 1904-1905"".",1.0
14,)* 1977: Hymn of the French Socialist Party* 1978: Hymn for Malta * 1982: Hymn of P.L.O.,)*1977: Hymn of the French Socialist Party*1978: Hymn for Malta*1982: Hymn of P.L.O.,)* 1977: Hymn of the French Socialist Party* 1978: Hymn for Malta * 1982: Hymn of P.L.O.,0.452
15,== Poza YouTube ==Sukces na YouTube zaowocował w oferty międzynarodowych kompanii takich jak Chevrolet i MTV.,==Beyond YouTube==The YouTube success has resulted in offers from international companies like Chevrolet and MTV.,==Beyond YouTube==Success on YouTube has resulted in offers from international companies such as Chevrolet and MTV.,0.482
16,"U Jana 8,10a zawiera: Ιησους ειδεν αυτην και zamiast: Ιησους και μηδενα θεασαμενος πλην της γυναικος; niektóre rękopisy mają jedynie: Ιησους.","In John 8:10a it reads Ιησους ειδεν αυτην και against reading: Ιησους και μηδενα θεασαμενος πλην της γυναικος, and reading: Ιησους.",In John 8:10a contains: Ιησους ειδεν αυτην και instead of: Ιησους και μηδενα θεασαμενος πλην της γυναικος; some manuscripts have only: Ιησους.,0.441
17,"ex A.12 lipca 1876 w Jersey City, New Jersey, zm.26 sierpnia 1676 w Houghton Hall, Norfolk, zm.","(s.l.He was born in Jersey City, New Jersey and died in New York City.==Early life==Walpole was born in Houghton Hall, Norfolk, in 1676.","ex A.July 12, 1876 in Jersey City, New Jersey – August 26, 1676 in Houghton Hall, Norfolk, died August 26, 1676.",0.272
18,"rej.AJ-Press.Wersja Memory Stick Duo oraz Memory Stick PRO Duo to wersje kart pamięci, w których wielkość karty zredukowano o połowę.",Prototype.1. pp.=== Memory Stick ===The original Memory Stick is approximately the size and thickness of a stick of chewing gum.,reg. AJ-Press.Memory Stick Duo and Memory Stick PRO Duo are versions of memory cards in which the size of the card has been reduced by half.,0.0
19,"Projekt tworzą M. C. (Martin) Schmidt i Drew Daniel, ale współpracują też z innymi artystami, zwłaszcza z J Lesserem.== Lista systemów operacyjnych wykorzystujących nakładkę ==* Windows 2000 Limited Edition (wersja ia64 dla procesorów Itanium)* Microsoft Windows XP Professional x64 Edition* Windows Server 2003 (amd64, ia64)* Windows Vista (amd64)* Windows Server 2008 (amd64, ia64)* Windows 7 (amd64)* Windows 8/8.1 (amd64)Deel 1.","M. C. (Martin) Schmidt and Drew Daniel, Ph.D. are the core members, but they frequently include other artists on their records and in their performances, including notably J Lesser.WoW64 (Windows 32-bit on Windows 64-bit) is a subsystem of the Windows operating system capable of running 32-bit applications and is included on all 64-bit versions of Windows—including Windows XP Professional x64 Edition, IA-64 and x64 versions of Windows Server 2003, as well as 64-bit versions of Windows Vista, Windows Server 2008, Windows 7, Windows 8 and Windows 8.1.Th.J.G.","The project consists of M.C. (Martin) Schmidt and Drew Daniel, but also collaborates with other artists, especially J Lesser.==List of overlay operating systems==* Windows 2000 Limited Edition (ia64 version for Itanium processors)* Microsoft Windows XP Professional x64 Edition* Windows Server 2003 (amd64, ia64)* Windows Vista (amd64)* Windows Server 2008 (amd64, ia64)* Windows 7 (amd64)* Windows 8/8.1 (amd64)Deel 1.",0.131
20,"Ozzy – 5:57#* Pierwotnie wydany na ""Black Sabbath"".",""" — Primus with Ozzy - 5:57#* Originally released on ""Black Sabbath"".","Ozzy – 5:57#* Originally released on ""Black Sabbath"".",0.537
21,Ang.Grał kolejno w następujących klubach: 1.q.e.d.Siljan – jezioro i krater uderzeniowy w Szwecji.,"W. A.Following this he transferred to 1.Q.E.D.Siljan, in Dalarna in central Sweden, is Sweden's sixth largest lake.","He played for 1.q.e.d.Siljan, a lake and impact crater in Sweden.",0.0
22,"Jako łowcy ptaki zachowują się zupełnie inaczej niż ssaki, polegając na precyzji swojego wzroku w poszukiwaniu ofiary, dlatego zazwyczaj (z wyjątkiem sów) polują one w ciągu dnia.","As hunters, birds behave very differently from mammals, relying on their powerful vision to find prey, and thus they usually (with the exception of owls) hunt by day.","As hunters, birds behave completely differently from mammals, relying on the precision of their eyesight in search of prey, which is why they usually (with the exception of owl) hunt during the day.",0.333
23,"Na każde 100 kobiet przypada 91,00 mężczyzn.",For every 100 females there were 91.00 males.,For every 100 females there were 91.00 males.,1.0
24,"Obszar przyciągnął także wielu biednych ludzi, którzy stali się rolnikami na własne potrzeby.","The area also drew many poor, disfranchised people who became subsistence farmers.",The area also attracted many poor people who became self-farm farmers.,0.0
25,"Zbudowana i uruchomiona na orbicie Jowisza sonda o parametrach podobnych do tych z pierwotnego Projektu Dedal, mogłaby dolecieć do Gwiazdy Barnarda w ciągu 47 lat.","Built and launched in Jovian orbit, it would reach Barnard's Star in 47 years under parameters similar to those of the original Project Daedalus.","Built and launched in Jupiter orbit, the spacecraft, with parameters similar to those of the original Daedalus Project, could reach Barnard's Star in 47 years.",0.535
26,"Poza tym kompozytor prowadzi warsztaty mistrzowskie na uniwersytecie w Paryżu i w Royal College of Music w Londynie.Największe sukcesy odnosił w Palmeiras i Corinthians.W międzyczasie Eide wraz z Yusufem ""Vicotnikiem"" Parvezem założył zespół Ved Buens Ende, w którym występował z przerwami do jego rozwiązania w 2007 roku.Prędkość maksymalna z dwiema osobami na pokładzie jest szacowana na ""nie mniej niż 190 km/h (118 mph)"".Fallen Angel – dwunasty album brytyjskiej rockowej grupy Uriah Heep wydany w 1978.","Desplat has also given Master Classes at La Sorbonne in Paris and the Royal College of Music in London.He played as a forward, mainly in the past with SE Palmeiras and Corinthians.He has gone back to playing guitar and was writing music for the re-grouped Ved Buens Ende, before the band once again split up in early 2007.The top speed with two persons is listed as ""not less than 190 km/h (118 mph)"".Fallen Angel is the 12th album released by British rock band Uriah Heep in 1978.","In addition, the composer conducts master classes at the University of Paris and the Royal College of Music in London.His greatest successes were in Palmeiras and Corinthians.Meanwhile, Eide, together with Yusuf ""Vicotnik"" Parvez, founded the band Ved Buens Ende, in which he performed intermittently until its dissolution in 2007. The maximum speed with two people on board is estimated at ""not less than 190 km/h (118 mph)"". Fallen Angel is the twelfth studio album by British rock band Uriah Heep, released in 1978.",0.264
27,Po przejęciu firmy ATI Technologies AMD przejęło również dział odpowiedzialny za projektowanie i produkcję chipsetów z serii Radeon Xpress.,"As the company completed the acquisition of ATI Technologies in 2006, the firm gained the ATI design team for chipsets which previously designed the Radeon Xpress 200 and the Radeon Xpress 3200 chipsets.","Following the acquisition of ATI Technologies, AMD also acquired the division responsible for the design and manufacture of Radeon Xpress series chipsets.",0.141
28,"W 1759 poślubił Mariannę Strzemeską, która zmarła w 1770.","He married Marianna Strzemeska in 1759, but she died in 1770 without children.","In 1759 he married Marianna Strzemeska, who died in 1770.",0.312
29,"* W 2009 Mattel współpracowało z NeuroSky by wypuścić grę Mindflex, która używała EEG do kierowania piłką przez tor przeszkód.","* In 2009 Mattel partnered with NeuroSky to release the Mindflex, a game that used an EEG to steer a ball through an obstacle course.","* In 2009, Mattel partnered with NeuroSky to release mindflex, which used EEG to steer a ball through an obstacle course.",0.632
30,"Często dochodzi do rozbieżności pomiędzy Housem a jego zespołem, zwłaszcza dr Allison Cameron, która odznacza się bardziej konserwatywnymi standardami etyki medycznej niż pozostałe postaci.","There are frequent disagreements between House and his team, especially Dr. Allison Cameron, whose standards of medical ethics are more conservative than those of the other characters.","There are often discrepancies between House and his team, especially Dr. Allison Cameron, who has more conservative standards of medical ethics than the other characters.",0.478
31,"W 1986 Buddy Holly został wprowadzony do ""Rock and Roll Hall of Fame"".Pierwsza lokomotywa z wczesną formą przegrzewacza pruskiej serii S 4 została zbudowana w 1898 roku, a produkowana seryjnie od 1902.","""Hey Buddy: In Pursuit of Buddy Holly, My New Buddy John, and My Lost Decade of Music"".The first superheated locomotive Prussian S 4 series, with an early form of superheater, was built in 1898, and produced in series from 1902.","In 1986, Buddy Holly was inducted into the Rock and Roll Hall of Fame. The first locomotive with an early form of superheater of the Prussian S 4 series was built in 1898, and mass-produced from 1902.",0.305
32,"Ludność miasta wynosi ponad 20 tys.Najdłuższa linia tramwajowa w Polsce to 46 z łódzkiej pętli Zdrowie do Ozorkowa o długości ok. 30 km.5 października 1952 roku w Monachium jako Harold Faltermeier) – niemiecki muzyk, kompozytor i producent.nauk.Składa się głównie z piroksenów (omfacyt) i granatów (pirop).Najbardziej popularnym zbiorem takich cech - imion jest Lalita-Sahasra-Nama, tysiąc imion Bogini Śri Lalita Dewi.Młodzi gniewni (ang.Początkowo ligę tworzyło pięć zespołów: Hallelujah, Daewoo, POSCO, Yukong Elephants i Kookmin Bank FC.Obecnie jest budowana linia tramwajowa do Fordonu o długości 9,5 km.","The town's population is 20,618.The longest of these, and in fact the longest of all of Poland, is number 46, which has a length of 38 km.Harold Faltermeyer (born Harald Faltermeier; 5 October 1952) is a German musician, keyboardist, composer and record producer.1844.To get a basalt from melting an eclogite (i.e.*Joshi, L. M., ""Lalita Sahasranama: A Comprehensive Study of the One Thousand Names of Lalita Maha-tripurasundari.Tambourine Man'...The initial five clubs were Hallelujah FC, Yukong Elephants, POSCO Dolphins, Daewoo Royals, Kookmin Bank FC.There are 9 lines with a total length of 63,5 km.","The population of the city is more than 20 thousand. The longest tram line in Poland is the 46th from the Łódź loop Zdrowie to Ozorków with a length of about 30 km.On October 5, 1952 in Munich as Harold Faltermeier) is a German musician, composer and producent.nauk.Sk the mainly made of pyroxenes (omfacite) and pomegranates (pyrope). The most popular collection of such qualities - names is Lalita-Sahasra-Nama, a thousand names of the Goddess Sri Lalita Devi.The Angry Young (English: Initially, the league consisted of five teams: Hallelujah, Daewoo, POSCO, Yukong Elephants and Kookmin Bank FC. A 9.5 km long tram line to Fordon is currently under construction.",0.067
33,"Do końca lat 70. proporcje obrazu zmieniano jeszcze dwa razy najpierw 2,35:1 a później 2,40:1, a format akademii stracił na znaczeniu jako kinowy i był używany głównie w telewizji.",Since the 1950s the aspect ratio of some theatrically released motion picture films has been 1.85:1 (1.66:1 in Europe) or 2.35:1 (2.40:1 after 1970).,"By the end of the 70s, the aspect ratio was changed two more times, first 2.35:1 and later 2.40:1, and the academy format lost its importance as a cinematic one and was mainly used on television.",0.0
34,Boppard i Oberwesel przeciwstawiały się włączeniu w struktury państwa terytorialnego.,Boppard and Oberwesel resisted of integration into a modern territorial state for a long time.,Boppard and Oberwesel opposed the incorporation into the structures of the territorial state.,0.0
35,"Badacze są świadomi tego, że etyczny wydźwięk, odpowiednio moderowany entuzjazm w mediach i edukacja na temat systemów BCI będą niezwykle ważne dla społecznej akceptacji tej technologii.","Researchers are well aware that sound ethical guidelines, appropriately moderated enthusiasm in media coverage and education about BCI systems will be of utmost importance for the societal acceptance of this technology.","Researchers are aware that ethical overtones, properly moderated media enthusiasm and education about BCI systems will be extremely important for public acceptance of this technology.",0.318
36,"Odkrył ją Philippe Loys de Chéseaux w 1745 roku.Messier 40 (w skrócie M40, również Winnecke 4, WNC4) – układ dwóch gwiazd, znajdujący się w gwiazdozbiorze Wielkiej Niedźwiedzicy.",It was discovered by Philippe Loys de Chéseaux in 1745 and included in Charles Messier's list in 1764.Winnecke 4 (also known as Messier 40 or WNC 4) is a double star in the constellation Ursa Major.,"It was discovered by Philippe Loys de Chéseaux in 1745. Messier 40 (abbreviated as M40, also Winnecke 4, WNC4) is a two-star system in the constellation Ursa Major.",0.39
37,"Ostatecznie wybrano cztery filtry średniopasmowe ustawione na długości fal: 300 nm (bliskie ultrafioletowi), 450 nm (błękit), 606 nm (czerwień), 814 nm (bliskie podczerwieni).","In the end, four broadband filters were chosen, centred at wavelengths of 300 nm (near-ultraviolet), 450 nm (blue light), 606 nm (red light) and 814 nm (near-infrared).","In the end, four medium-band filters set at wavelengths were selected: 300 nm (close to ultraviolet), 450 nm (blue), 606 nm (red), 814 nm (near infrared).",0.203
38,"""===Tekst angielski===:""Samoa, arise and raise your flag, your crown!","""English translation::""Samoa, arise and raise your flag, your crown!","""===English text===:""Samoa, arise and raise your flag, your crown!",0.751
39,FC Nürnberg (1998-99) i VfB Stuttgart (1999–2000).,"FC Nürnberg (1998–99), and VfB Stuttgart (1999–2000).",FC Nürnberg (1998-99) and VfB Stuttgart (1999-2000).,0.0
40,"1 maja obchodzony był po raz pierwszy w 48 lat, a około pół miliona osób zebrało się w Lizbonie aby usłyszeć przemówienia komunistycznego przywódcy Álvaro Cunhal i socjalisty Mário Soares.","May Day was commemorated for the first time in 48 years, and an estimated half million people gathered in the FNAT Stadium (now May 1 Stadium) in Lisbon to hear speeches by Cunhal and the socialist Mário Soares.","May 1 was celebrated for the first time in 48 years, and about half a million people gathered in Lisbon to hear speeches by Communist leader Álvaro Cunhal and socialist Mário Soares.",0.425
41,Po otrzymaniu certyfikatów jednocześnie od FAA i JAA pierwszy -300 został dostarczony do Cathay Pacific 21 maja 1998 roku.,"After being certified simultaneously by the FAA and JAA, the first -300 was delivered to Cathay Pacific on May 21, 1998.","After receiving certifications from both the FAA and JAA, the first -300 was delivered to Cathay Pacific on May 21, 1998.",0.754
42,W 1797 rozpoczął studia na uniwersytecie w Getyndze.,He entered the University of Göttingen in 1797.,In 1797 he began his studies at the University of Göttingen.,0.294
43,"Znaczenie tego oświadczenia było zazwyczaj jasne w kontekście: uważał, że kwarki są ukryte, ale również implikował, że oddziaływania silne przypuszczalnie nie będą się dały w pełni opisać kwantową teorią pola.","The meaning of this statement was usually clear in context: He meant quarks are confined, but he also was implying that the strong interactions could probably not be fully described by quantum field theory.","The meaning of this statement was usually clear in context: he believed that quarks were hidden, but also implied that strong interactions would probably not be fully described by quantum field theory.",0.562
44,Odegrali dużą rolę w XVI i XVII wieku.,Magnates in the 16th and 17th century.,They played a large role in the sixteenth and seventeenth centuries.,0.0
45,Liczba mieszkańców w 2000 roku wynosiła 1 344.Liczba mieszkańców w 2000 roku wynosiła 8 202.FC Lokomotíva Košice – słowacki klub piłkarski z siedzibą w Koszycach.,"The median age in the city was 36.2 years.The median age in the city was 34.6 years.FC Lokomotíva Košice is a Slovak football club, playing in the town of Košice.","The population was 1,344 at the 2000 census.The population was 8,202 at the 2000 census.FC Lokomotíva Košice is a Slovak football club based in Košice.",0.225
46,"=== Olympique Lyon ===Po udanym okresie w Rennes, w czerwcu 2006 roku Källström przeszedł do Lyonu, z którym to klubem zdobył w kolejnych latach szereg trofeów.","===Olympique Lyonnais===After a successful spell at Rennes, Källström signed for Lyon in June 2006, and went on to win a number of honours with the southern club.","===Olympique Lyonnais===After a successful period in Rennes, Källström moved to Lyon in June 2006, with whom he won a number of trophies in the following years.",0.242
47,Na miejscu pojawiły się pierwsze siły policji i Securitate.,"Subsequently, police and ""Securitate"" forces showed up at the scene.",The first police forces and the Securitate arrived on the scene.,0.0
48,"""Annals and Magazine of Natural History"", August.","""Annals and Magazine of Natural History"", August.","""Annals and Magazine of Natural History"", August.",1.0
49,"* ""Philosophie der Logik und Arithmetik"", Monachium, 1931.","*""Philosophie der Logik und Arithmetik"", Munich, 1931.","* ""Philosophie der Logik und Arithmetik"", Munich, 1931.",1.0
50,"przez KDE, exim, PHP i tin.Post Office Protocol version 3 (POP3) to protokół internetowy z warstwy aplikacji pozwalający na odbiór poczty elektronicznej ze zdalnego serwera do lokalnego komputera poprzez połączenie TCP/IP.",";Minimal matching (a.k.a.In computing, the Post Office Protocol (POP) is an application-layer Internet standard protocol used by local e-mail clients to retrieve e-mail from a remote server over a TCP/IP connection.","via KDE, exim, PHP and tin. Post Office Protocol version 3 (POP3) is an application-layer Internet protocol that allows you to receive e-mail from a remote server to a local computer over a TCP/IP connection.",0.276
