,Sentences_from,Sentences_to,Translated_sentences,BLEU
474,Papież Benedykt XVI wylądował w Sydney 13 lipca 2008 w bazie Sił Powietrznych Richmond.,Pope Benedict XVI arrived in Sydney on 13 July 2008 at Richmond Air Force Base.,"Pope Benedict XVI landed in Sydney on July 13, 2008 at Richmond Air Force Base.",0.513
475,W 1814 jej ojciec został przywrócony na tron Piemontu i rodzina wróciła do Turynu.Jako pierwszy zawodnik złamał w biegu na 3000 m z przeszkodami barierę 8 minut.Lufthansa CityLine - niemieckie linie lotnicze z siedzibą w Kolonii.,"In 1814 her father was restored to rule in Piedmont and the family returned to Turin.Kiptanui was also the first man ever to run 3000 m steeplechase in under eight minutes.Lufthansa CityLine GmbH is a regional airline based in Cologne, Germany.","In 1814, her father was restored to the throne of Piedmont and the family returned to Turin.He was the first competitor to break the 8-minute barrier in the 3000 m hurdles. Lufthansa CityLine is an airline based in Cologne, Germany.",0.378
476,"Na początku roku 1825, podczas pierwszej wojny angielsko-birmańskiej, siły brytyjskie wylądowały w Sittwe i rozłożyły kwaterę na terenie starodawnej pagody Ahkyaib-daw, która do dziś jest czołową świątynią miasta.","In early 1825, during the First Anglo-Burmese War, the British forces landed at Sittwe and stationed their forces by the ancient pagoda, Ahkyaib-daw, which is still standing at the head of the city.","In early 1825, during the First Anglo-Burmese War, British forces landed at Sittwe and laid out headquarters in the ancient Ahkyaib-daw pagoda, which is still the city's frontal temple.",0.415
477,"== Opis fabuły ==Taylor i Courtney Callum to dwie rozpuszczone, ale dobroduszne siostry, których ojciec Reed Callum (Jack Coleman) prowadzi firmę mleczarską ""Callum Dairy"".","==Plot==Aly Michalka and AJ Michalka star as Taylor and Courtney Callum, two thoroughly spoiled yet well-intentioned sisters whose widower father, Reed Callum (Jack Coleman), owns Callum Dairy.",==Plot==Taylor and Courtney Callum are two spoiled but good-natured sisters whose father Reed Callum (Jack Coleman) runs the dairy company Callum Dairy.,0.215
478,== Obsada ==* Tom Berenger jako generał James Longstreet (CSA)* Jeff Daniels jako pułkownik Joshua Chamberlain (USA)* Martin Sheen jako generał Robert E. Lee (CSA)* Kevin Conway jako Buster Kilrain (USA)* C. Thomas Howell jako porucznik Thomas Chamberlain (USA)* Richard Jordan jako generał Lewis A.,==Cast==* Tom Berenger as Lieutenant General James Longstreet (CSA)* Jeff Daniels as Colonel Joshua Chamberlain (USA)* Martin Sheen as General Robert E. Lee (CSA)* Sam Elliott as Brigadier General John Buford (USA)* Stephen Lang as Major General George Pickett (CSA)* Kevin Conway as Sergeant Buster Kilrain (USA)* C. Thomas Howell as Lieutenant Thomas Chamberlain (USA)* Richard Jordan as Brigadier General Lewis A.,==Cast==* Tom Berenger as General James Longstreet (CSA)* Jeff Daniels as Colonel Joshua Chamberlain (USA)* Martin Sheen as General Robert E. Lee (CSA)* Kevin Conway as Buster Kilrain (USA)* C. Thomas Howell as Lieutenant Thomas Chamberlain (USA)* Richard Jordan as General Lewis A.,0.593
479,"* W sezonie 2004/2005 Dyskobolia odniosła podwójny sukces.mieszkańców w styczniu 2011) na północnym zachodzie Węgier, w komitacie Győr-Moson-Sopron, ośrodek administracyjny powiatu Pannonhalma.W tym czasie miasto liczyło już około 14 tys.","However within a year Dyskobolia was in the top flight again.Pannonhalma is a town in western Hungary, in Győr-Moson-Sopron county with approximately 4,000 inhabitants.By this time, Szekszárd already had 14,000 residents.","* In the 2004/2005 season Dyskobolia was a double success.The inhabitants in January 2011 in the northwest of Hungary, in the county of Győr-Moson-Sopron, the administrative center of the district of Pannonhalma.At that time, the city already had about 14,000 inhabitants.",0.0
480,""" (Wersja oryginalna) – 3:05Side B:# ""Mambo!",""" version – 3:05Side B:# ""Mambo!",""" (Original Version) – 3:05Side B:# ""Mambo!",0.819
481,W ten sposób te organizacje odgrywają ważną rolę w zachowaniu standardów etycznych dla zawodu.,In this way these organizations play an important role in maintaining ethical standards for the profession.,"In this way, these organizations play an important role in maintaining ethical standards for the profession.",1.0
482,Walka z Sullivanem odbyła się 7 września 1892 w Nowym Orleanie.Puebla – stan w środkowo-wschodnim Meksyku.,"The champion reluctantly agreed, and the fight was finally set.It is located in East-Central Mexico.","Sullivan was fought on September 7, 1892 in New Orleans, California.Puebla is a state in eastern Mexico.",0.0
483,"== Sąsiednie gminy ==Brzeźnica, Iłowa, Małomice, Nowogród Bobrzański, Osiecznica, Szprotawa, Żagań, Żary== Demografia ==Dane z 30 czerwca 2004:== Sołectwa ==Brzeziny, Chlina, Jeziorowice, Koryczany, Łany Małe, Łany Średnie, Łany Wielkie, Małoszyce, Otola, Otola Mała, Udórz, Wola Libertowska, Zabrodzie, Żarnowiec.","==Neighbouring gminas==Gmina Żagań is bordered by the town of Żagań and by the gminas of Brzeźnica, Iłowa, Małomice, Nowogród Bobrzański, Osiecznica, Szprotawa and Żary.==Villages==Gmina Żarnowiec contains the villages and settlements of Brzeziny, Chlina, Chlina Dolna, Jeziorowice, Koryczany, Łany Małe, Łany Średnie, Łany Wielkie, Małoszyce, Ostra Górka, Otola, Otola Mała, Udórz, Wola Libertowska, Zabrodzie, Zamiechówka and Żarnowiec.","==Neighbouring gminas==Gmina Brzeźnica is bordered by the gminas of Brzeźnica, Iłowa, Małomice, Nowogród Bobrzański, Osiecznica, Szprotawa, Żagań and Żary.==Villages==Gmina Łany contains the villages and settlements of Brzeziny, Chlina, Jeziorowice, Koryczany, Łany Małe, Łany Średnie, Łany Wielkie, Małoszyce, Otola, Otola Mała, Udórz, Wola Libertowska, Zabrodzie and Żarnowiec.",0.599
484,"Podczas „panowania” Jericho jako dyrektora generalnego, ten pozbawił Triple H’a jego mistrzostwa świata wagi ciężkiej, ponieważ Triple Threat Match o ten tytuł, który odbył się tydzień wcześniej, zakończył się remisem.","During Jericho's turn as General Manager, he stripped Triple H of his World Heavyweight Championship because a Triple Threat match for the title a week earlier ended in a draw.","During Jericho's reign as CEO, he stripped Triple H of his World Heavyweight Championship, as the Triple Threat Match for the title, which had taken place the week before, ended in a draw.",0.477
485,"Leży na północnym wschodzie kraju i sąsiaduje ze stanami Plateau, Taraba, Gombe, Yobe, Jigawa i Kano.Jego stolicą jest Yenagoa.Stan zamieszkuje kilka grup etnicznych: Tiv, Idoma, Igede, Etulo, Abakpa, Jukun, Hausa, Akweya i Nyifon.","The state is bordered by seven states, Kano and Jigawa to the north, Taraba and Plateau to the south, Gombe and Yobe to the east and Kaduna to the west.Its capital is Yenagoa.==People and culture==The state is populated by several ethnic groups: Tiv, Idoma, Igede, Etulo, Abakpa, Jukun, Hausa, Akweya and Nyifon.","It lies in the northeast of the country and is bordered by the states of Plateau, Taraba, Gombe, Yobe, Jigawa and Kano.Its capital is Yenagoa.The state is inhabited by several ethnic groups: Tiv, Idoma, Igede, Etulo, Abakpa, Jukun, Hausa, Akweya and Nyifon.",0.331
486,Siły Unii wycofały się z doliny.,Union forces were withdrawn from the Valley.,Union forces withdrew from the valley.,0.0
487,W 1883 została nabyta przez Waltera Higgina i przebudowana.,It was then acquired by Walter Higgin in 1883 and rebuilt.,In 1883 it was acquired by Walter Higgin and rebuilt.,0.351
488,"Realizował też teledyski muzyczne między innymi dla Micka Jaggera, do piosenki ""Imagine"" Johna Lennona, dla Simple Minds, The Art of Noise, Chucka Mangione, Pet Shop Boys, Alan Parsons Project, Yoko Ono, Lou Reeda, Supertramp, Rush, Lady Pank (angielska wersja piosenki ""Mniej niż zero"").","Between 1984 and 1989 he made more than 30 music videos for such artists as Mick Jagger, Yoko Ono, Lou Reed, Simple Minds, Cameo, The Art of Noise, Chuck Mangione, Pet Shop Boys, Lady Pank, The Alan Parsons Project, Supertramp and Rush.","He has also made music videos for Mick Jagger, John Lennon's ""Imagine"", Simple Minds, The Art of Noise, Chuck Mangione, Pet Shop Boys, Alan Parsons Project, Yoko Ono, Lou Reed, Supertramp, Rush, Lady Pank (English version of ""Less Than Zero"").",0.353
489,"W 1973 fani Duane'a wyrzeźbili ogromne litery ""REMEMBER DUANE ALLMAN"" w piaskowcu stanowiącym nasyp wzdłuż drogi Interstate 20 koło Vicksburga w stanie Mississippi.",""")In 1973, fans carved the very large letters ""REMEMBER DUANE ALLMAN"" in a dirt embankment along Interstate Highway 20 near Vicksburg, Mississippi.","In 1973, Duane's fans carved the huge letters ""REMEMBER DUANE ALLMAN"" into the sandstone embankment along Interstate 20 near Vicksburg, Mississippi.",0.331
490,"Zheng He został dowódcą floty i nadzorcą portu w Nankinie.=== 1978 – mistrzostwo świata ===W 1974 roku selekcjonerem reprezentacji Argentyny został César Luis Menotti.W 1/8 finału pokonali Chile 3:0.W Iranie piłka nożna cieszy się ogromną popularnością.Od 1993 są też zapraszane niektóre zespoły z Ameryki Północnej (choć nie jest to regułą - w 1999 r. na turnieju grała Japonia, która została też zaproszona do udziału w CA 2011) – zazwyczaj są to mistrz i wicemistrz turnieju o Złoty Puchar CONCACAF.BGP w wersji czwartej jest podstawą działania współczesnego internetu.","In modern times, interest in Zheng He revived substantially.Argentina's World Cup winning managers are César Luis Menotti in 1978, and Carlos Bilardo in 1986.They faced Chile in the Round of Last 16.Iran played against Portugal in the second game.Nations receiving invitations are Costa Rica (1997, 2001, 2004, 2011), Honduras (2001), Japan (1999, 2011, 2015), Mexico (1993, 1995, 1997, 1999, 2001, 2004, 2007, 2011), and the United States (1993, 1995, 2007).Version 4 of BGP has been in use on The Internet since 1994.","Zheng He became the commander of the fleet and the overseer of the port of Nanjing.==========In 1974, César Luis Menotti became the argentina national team coach.In 1/8 of the final, they defeated Chile 3–0.In Iran, football is very popular. Since 1993, some teams from North America have also been invited (although this is not the rule - in 1999 Japan played at the tournament, which was also invited to participate in CA 2011) - usually they are the champion and vice-champion of the CONCACAF Gold Cup tournament. BGP in the fourth version is the basis for the operation of the modern Internet.",0.0
491,Została ona niegdyś przypisana pisarzowi Wauchier de Denain i dlatego nazywana jest czasami Pseudo-Wauchier.,"It was once attributed to Wauchier de Denain, and is still sometimes called the Pseudo-Wauchier Continuation for that reason.",It was once attributed to the writer Wauchier de Denain and is therefore sometimes called Pseudo-Wauchier.,0.425
492,"Jest także 50 stanowisk dla osób, które mają problemy ze wzrokiem.",There are also 50 places for people who have vision problems.,There are also 50 positions for people who have vision problems.,0.702
493,"Podsystem środowiska POSIX umożliwia uruchamianie aplikacji, które ściśle przestrzegają standardu POSIX.1, lub związanych z nim standardów ISO/IEC.",*The POSIX environment subsystem supports applications that are strictly written to either the POSIX.1 standard or the related ISO/IEC standards.,The POSIX subsystem allows you to run applications that strictly follow the POSIX.1 standard or related ISO/IEC standards.,0.224
494,"1633)* 1685 – Michel le Tellier, francuski mąż stanu (ur.","1616)*1685 – Michel Le Tellier, French politician, French Secretary of State for War (b.","1633)*1685 – Michel le Tellier, French statesman (b.",0.278
495,"Bardzo chętnie natomiast używa Boitel akwareli – między innymi w Nicei, we Włoszech i Sancerrois.","He painted many watercolours, in particular in Nice, in Italy and in Sancerrois.","Boitel is very eager to use watercolors – among others in Nice, Italy and Sancerrois.",0.0
496,"Robert razem z Elżbietą zostali koronowani na króla i królową Szkocji w Scone, 27 marca 1306.","On 27 March 1306, Robert and Elizabeth were crowned as King and Queen of Scots at Scone.",Robert and Elizabeth were crowned King and Queen of Scotland at Scone on 27 March 1306.,0.533
497,Znanym cudem natury jest najdłuższy (40 m) amerykański naturalny most na wschód od Gór Skalistych położony na południe od Haleyville.,"A notable natural wonder in Alabama is ""Natural Bridge"" rock, the longest natural bridge east of the Rockies, located just south of Haleyville.",A well-known natural wonder is the longest (40 m) American natural bridge east of the Rocky Mountains located south of Haleyville.,0.259
498,"Or My Mom Will Shoot"") – amerykański film fabularny z 1992 roku w reżyserii Rogera Spottiswoode'a.Port lotniczy Kamembe - port lotniczy zlokalizowany w mieście Kamembe, w Ruandzie.Wyniki Grand Prix Szwajcarii na francuskim torze Dijon-Prenois 29 sierpnia 1982.Definicja wskazuje, że zdrowie reprodukcyjne implikuje, iż ludzie mogą prowadzić odpowiedzialne, satysfakcjonujące i bezpieczne życie seksualne i mają możliwość reprodukowania się oraz wolność decyzji co do tego, kiedy i jak często to robić.Aż trzykrotnie pojawił się na okładkach amerykańskiego tygodnika Time: 26 listopada 1923, 18 lipca 1927 oraz 8 lutego 1932.","Or My Mom Will Shoot is a 1992 American buddy cop comedy film directed by Roger Spottiswoode.Kamembe International Airport is an airport near Cyangugu and Kamembe in Rwanda .The 1982 Swiss Grand Prix was a Formula One motor race held at Dijon-Prenois in France on August 29, 1982.Reproductive health implies that people are able to have a responsible, satisfying and safer sex life and that they have the capability to reproduce and the freedom to decide if, when and how often to do so.Gibson was on the front cover of ""Time"" for the November 26, 1923, July 18, 1927 and the February 8, 1932 issues.","Or My Mom Will Shoot is a 1992 American film directed by Roger Spottiswoode. Kamembe Airport is an airport in Kamembe, Rwanda.The 1982 Swiss Grand Prix was a Swiss Grand Prix held at Dijon-Prenois on August 29, 1982.The definition indicates that reproductive health implies that people can lead a responsible, satisfying and safe sex life and have the ability to reproduce themselves and the freedom to decide when and how often to do so. He appeared on the covers of time magazine three times: November 26, 1923, July 18, 1927, and February 8, 1932.",0.398
499,"Nie udało mu się przejąć Neapolu pomimo oblężenia (podobnie jak Zotto), ale zdobył Salerno pod koniec lat 20.Wayans stworzył i zagrał wraz z Marlonem w sitcomie ""The Wayans Bros."".Goatwhore - amerykański zespół grający Blackened death metal, powstały w Thibodaux, Luizjana, w roku 1997.Osiadły.* Był członkiem bractwa studenckiego o nazwie Lambda Chi Alpha.W skład zespołu wchodzą Abbath Doom Occulta z Immortal, King ov Hell z Gorgoroth, Ice Dale z Enslaved oraz Armagedda.","He failed to take Naples after a siege (Zotto had failed likewise), but he took Salerno by the late 620s.Along with Marlon, Shawn Wayans created and starred in the sitcom ""The Wayans Bros"".Goatwhore is an American blackened death metal band, formed in 1997 in New Orleans, Louisiana.Zoology.At The University of the South, Mount was a member of Lambda Chi Alpha fraternity.The band features Immortal members Abbath and Armagedda, Gorgoroth bassist TC King, and Enslaved's Ice Dale.","He failed to take over Naples despite the siege (as did Zotto), but captured Salerno in the late 20s.Wayans created and starred with Marlon in the sitcom ""The Wayans Bros."". Goatwhore is an American blackened death metal band formed in Thibodaux, Louisiana in 1997.They settled.* They were a member of a student fraternity called Lambda Chi Alpha.The band consists of Abbath Doom Occulta of Immortal, King ov Hell of Gorgoroth, Ice Dale of Enslaved, and Armagedda.",0.262
500,"La Furia Roja okazał się zbyt silny dla Brazylii w finale w Gwatemali (2000) i fazie półfinałowej na Tajwanie (2004), gdzie mieli zamiar zdobyć tytuł raz jeszcze.Grupa galaktyk Lew I (również Grupa M96) – grupa galaktyk znajdująca się w konstelacji Lwa.","La Furia Roja proved too strong for Brazil in the Final of Guatemala 2000 and at the semi-final stage of Chinese Taipei 2004, where they went on to take the title once more.The M96 Group (also known as the ""Leo I Group"") is a group of galaxies in the constellation Leo.","La Furia Roja proved too strong for Brazil in the final in Guatemala (2000) and the semi-final stage in Taiwan (2004), where they were going to win the title again. The Leo I group of galaxies (also called M96 Group) is a group of galaxies in the constellation Leo.",0.515
501,Do jego studentów należeli kompozytorzy Pierre Boulez i Karel Goeyvaerts oraz pianistka Yvonne Loriod.,Among his early students were the composers Pierre Boulez and Karel Goeyvaerts.,His students included composers Pierre Boulez and Karel Goeyvaerts and pianist Yvonne Loriod.,0.412
502,"W hrabstwie znajduje się 4 368 gospodarstw domowych, w których 33,20% stanowią dzieci poniżej 18 roku życia mieszkający z rodzicami, 59,10% małżeństwa mieszkające wspólnie, 7,60% stanowią samotne matki oraz 29,40% to osoby nie posiadające rodziny.","There were 4,368 households out of which 33.20% had children under the age of 18 living with them, 59.50% were married couples living together, 7.60% had a female householder with no husband present, and 29.40% were non-families.","There were 4,368 households out of which 33.20% had children under the age of 18 living with them, 59.10% were married couples living together, 7.60% had a mother alone, and 29.40% were non-families.",0.712
503,"Co więcej, po raz pierwszy jej francuskojęzyczna piosenka znalazła się na Switzerland Singles Chart, gdzie trafiła na 58. miejsce.","It also became Anggun's first French single to chart on the Swiss Singles Chart, peaking at number 58.","What's more, for the first time her French-language song reached the Switzerland Singles Chart, where it hit number 58.",0.0
504,Obecnie mieści się tu I Liceum Ogólnokształcące im.Współcześnie nazwę tę nosi największy uniwersytet litewski.,"The present-day ""I Liceum Ogólnokształcące im.It is the largest university in Lithuania.","Currently, it houses the First High School named after.Nowadays, this name is given to the largest Lithuanian university.",0.0
505,"Około 5,6% rodzin i 8,7% populacji żyło poniżej progu ubóstwa, w tym 16,7% poniżej lat 18 i 3,3% powyżej lat 65.Martos – miasto w Andaluzji (Hiszpania), nieopodal Jaén, liczące około 25 tys.Hypermnestra, Hypermestra) – w mitologii greckiej królewna, jedna z Danaid.""Николай Иванович Салтыков""), (ur.* 1981-1984 – uczestniczył w czterech lotach kosmicznych: jako pilot w STS-1 (12 – 14 kwietnia 1981) oraz jako dowódca misji STS-7 (18 – 24 czerwca 1983), STS-41-C (6 – 13 kwietnia 1984) oraz STS-41-G (5 – 13 października 1984).","About 5.6% of families and 8.7% of the population were below the poverty line, including 16.7% of those under age 18 and 3.3% of those age 65 or over.The city of Martos is located in the province of Jaén in the autonomous community of Andalusia in south-central Spain.Hypermnestra (), in Greek mythology, is the daughter of Danaus and the ancestor of the Danaids.==References==* Николай Иванович Салтыков (Nikolay Saltykov)He was the pilot of the first orbital test flight of the Space Shuttle program (STS-1, April 12–14, 1981) and was the commander of three additional Shuttle flights: STS-7, June 18–24, 1983; STS-41-C, April 6–13, 1984; and STS-41-G, October 6–13, 1984.","About 5.6% of families and 8.7% of the population were below the poverty line, including 16.7% of those under age 18 and 3.3% of those age 65 or over.Martos, a town of about 25,000 people in Andalusia, Spain. Hypermnestra () is a princess in Greek mythology, one of the Danaids. Николай Иванович Салтыков""), (born* 1981-1984 – participated in four space flights: as a pilot in STS-1 (12 – 14 April 1981) and as the commander of the STS-7 mission (18 – 24 June 1983), STS-41-C (6 – 13 April 1984) and STS-41-G (5 – 13 October 1984).",0.349
506,"1825)* 1901 – Abdur Rahman Chan, emir Afganistanu (ur.","1799)*1901 – Abdur Rahman Khan, Afghan emir (b.","1825)*1901 – Abdur Rahman Khan, Emir of Afghanistan (b.",0.338
507,"King of Mambo"" (2001)* ""Herman Meets Puente"" (2001)* ""Undisputed"" (2001)* ""Fiesta"" (2002)* ""Colección Diamante"" (2002)* ""Tito Puente y Celia Cruz"" (2002)* ""Live at the Playboy Jazz Festival"" (2002)* ""King of Kings: The Very Best of Tito Puente"" (2002)* ""Hot Timbales!BoA współpracowała z wytwórnią SM Entertainment, która przygotowywała współpracę z japońską firmą Avex Trax w celu wejścia na scenę muzyczną w Japonii.","King of Mambo"" (2001)*""Herman Meets Puente"" (2001)*""Undisputed"" (2001)*""Fiesta"" (2002)*""Colección Diamante"" (2002)*""Tito Puente y Celia Cruz"" (2002)*""Live at the Playboy Jazz Festival"" (2002)*""King of Kings: The Very Best of Tito Puente"" (2002)*""Hot Timbales!Meanwhile, her Korean record label, SM Entertainment, made arrangements with Japanese label Avex Trax to launch her music career in Japan.","King of Mambo"" (2001)* ""Herman Meets Puente"" (2001)* ""Undisputed"" (2001)* ""Fiesta"" (2002)* ""Colección Diamante"" (2002)* ""Tito Puente y Celia Cruz"" (2002)* ""Live at the Playboy Jazz Festival"" (2002)* ""King of Kings: The Very Best of Tito Puente"" (2002)* ""Hot Timbales! BoA collaborated with SM Entertainment, which was preparing a collaboration with the Japanese company Avex Trax to enter the music scene in Japan.",0.263
508,"Wypromieniowuje światło o długości 2097 nm i znajduje szerokie zastosowanie w wojsku, medycynie i meteorologii.","It lases at 2097 nm and is widely used in military applications, medicine, and meteorology.","It radiate light with a length of 2097 nm and is widely used in the military, medicine and meteorology.",0.394
509,"Podczas II wojny światowej część okien, zwłaszcza w południowej części katedry, uległa zniszczeniu.Kapłanki uprzedzają, że Mothra, ogromna ćma z Wyspy Infant wyda wojnę ludziom, jeśli tego nie zrobią, jeśli jednak zdecydują się zrezygnować z Kiryu, Mothra będzie strażnikiem Japonii.Fertőd - miasto na Węgrzech, w Komitacie Győr-Moson-Sopron, w powiecie Sopron-Fertőd.New Zealand Knights FC (założony jako Football Kingz FC) – nieistniejący nowozelandzki, profesjonalny klub piłkarski z siedzibą w Auckland, założony w 1999 roku.","During the Second World War some windows, particularly in the southern part of the cathedral, were damaged.If they return the bones to the bottom of the sea, Mothra would gladly take Kiryu's place in defending Japan, but if they do not, Mothra will declare war on humanity.Fertőd is a town located in the Győr-Moson-Sopron county of Hungary, not far from Austria.For information on seasons and results see New Zealand Knights seasons 2005–06 and 2006–07""New Zealand Knights Football Club (formed from the Football Kingz Football Club in 2004) were the only professional football (soccer) club in New Zealand before they became defunct.","During World War II, some of the windows, especially in the southern part of the cathedral, were destroyed. The priestesses warn that Mothra, a huge moth from Infant Island, will wage war on the people if they do not, but if they decide to give up Kiryu, Mothra will be the guardian of Japan.Fertőd is a town in Győr-Moson-Sopron county, Hungary.New Zealand Knights FC (founded football Kingz FC) is a defunct New Zealand professional football club based in Auckland, New Zealand, founded in 1999.",0.166
510,Jest to album dwupłytowy.30 minut z życia – drugi album polskiego rapera i producenta muzycznego O.S.T.R.-a.Masz to jak w banku – pierwszy album polskiego rapera i producenta muzycznego O.S.T.R.-a.,""" (How To Be...?30 Minut z Życia is a freestyle album released by polish rapper O.S.T.R.Masz To Jak W Banku is the debut album of O.S.T.R., a Polish rapper.",It is a two-disc album.30 minutes from life is the second album by Polish rapper and music producer O.S.T.R.-a.Masz to jak w banku is the first album by Polish rapper and music producer O.S.T.R.-,0.208
